Cites,Authors,Title,Year,Source,Publisher,ArticleURL,CitesURL,GSRank,QueryDate,Type,DOI,ISSN,CitationURL,Volume,Issue,StartPage,EndPage,ECC,CitesPerYear,CitesPerAuthor,AuthorCount,Age,Abstract,FullTextURL,RelatedURL
4,"G Lampropoulos","Augmented Reality and Artificial Intelligence in Education: Toward Immersive Intelligent Tutoring Systems",2023,"Augmented Reality and Artificial Intelligence: The …","Springer","https://link.springer.com/chapter/10.1007/978-3-031-27166-3_8","https://scholar.google.com/scholar?cites=17739341947238421721&as_sdt=2005&sciodt=0,5&hl=en",189,"2023-12-13 11:24:03","","10.1007/978-3-031-27166-3_8","","",,,,,4,4.00,4,1,1,"… AR provides engaging, interactive and motivating mixed reality environments while AI offers personalized experiences. The aim of this chapter is to explore how the convergence of AI …","","https://scholar.google.com/scholar?q=related:2RRVkoPNLvYJ:scholar.google.com/&scioq=mixed+reality&hl=en&as_sdt=0,5&as_ylo=2021&as_yhi=2023"
3,"SMU Arif, M Brizzi, M Carli, F Battisti","Human reaction time in a mixed reality environment",2022,"Frontiers in Neuroscience","frontiersin.org","https://www.frontiersin.org/articles/10.3389/fnins.2022.897240/full?&utm_source=Email_to_authors_&utm_medium=Email&utm_content=T1_11.5e1_author&utm_campaign=Email_publication&field=&journalName=Frontiers_in_Neuroscience&id=897240","https://scholar.google.com/scholar?cites=10467956444106807062&as_sdt=2005&sciodt=0,5&hl=en",21,"2023-12-13 11:24:03","HTML","10.3389/fnins.2022.897240","","",,,,,3,3.00,1,4,1,"… Moreover, since a mixed reality application includes both … ways to interact with the mixed reality environment, such as … in the mixed reality environment as compared to 2D interfaces. …","https://www.frontiersin.org/articles/10.3389/fnins.2022.897240/full?&utm_source=Email_to_authors_&utm_medium=Email&utm_content=T1_11.5e1_author&utm_campaign=Email_publication&field=&journalName=Frontiers_in_Neuroscience&id=897240","https://scholar.google.com/scholar?q=related:Flc_n-ymRZEJ:scholar.google.com/&scioq=mixed+reality&hl=en&as_sdt=0,5&as_ylo=2021&as_yhi=2023"
3,"D Sonntag, O Bodensiek","How mixed reality shifts visual attention and success in experimental problem solving",2022,"Physical Review Physics Education Research","APS","https://journals.aps.org/prper/abstract/10.1103/PhysRevPhysEducRes.18.023101","https://scholar.google.com/scholar?cites=793704747521465701&as_sdt=2005&sciodt=0,5&hl=en",30,"2023-12-13 11:24:03","","10.1103/PhysRevPhysEducRes.18.023101","","",,,,,3,3.00,2,2,1,"While commercially available mixed-reality (MR) head-mounted devices are also increasingly used in education the impact of MR learning environments is mostly being evaluated with …","https://link.aps.org/pdf/10.1103/PhysRevPhysEducRes.18.023101","https://scholar.google.com/scholar?q=related:Zd2OPEPOAwsJ:scholar.google.com/&scioq=mixed+reality&hl=en&as_sdt=0,5&as_ylo=2021&as_yhi=2023"
3,"CT Chang, E Rosen, TR Groechel…","Virtual, augmented, and mixed reality for HRI (VAM-HRI)",2022,"2022 17th ACM/IEEE …","ieeexplore.ieee.org","https://ieeexplore.ieee.org/abstract/document/9889655/","https://scholar.google.com/scholar?cites=940999850811489252&as_sdt=2005&sciodt=0,5&hl=en",31,"2023-12-13 11:24:03","","","","",,,,,3,3.00,1,4,1,"… in mixed reality, use of virtual reality for developing interactive robots, the design of augmented reality … for virtual and mixed reality in HRI, the investigations of mixed reality interfaces for …","https://ieeexplore.ieee.org/iel7/9889327/9889305/09889655.pdf","https://scholar.google.com/scholar?q=related:5HtQ8WAaDw0J:scholar.google.com/&scioq=mixed+reality&hl=en&as_sdt=0,5&as_ylo=2021&as_yhi=2023"
3,"C Cox, B Hicks, J Gopsill","Improving Mixed-Reality Prototyping through a Classification and Characterisation of Fidelity",2022,"Proceedings of the Design Society","cambridge.org","https://www.cambridge.org/core/journals/proceedings-of-the-design-society/article/improving-mixedreality-prototyping-through-a-classification-and-characterisation-of-fidelity/0207DE9FA631E0225F40C540BFE40917","https://scholar.google.com/scholar?cites=3498057005577262402&as_sdt=2005&sciodt=0,5&hl=en",36,"2023-12-13 11:24:03","","","","",,,,,3,3.00,1,3,1,"… The past decade has seen a rise of Mixed Reality (MR) prototypes, where the tangibility and … This sliding scale of ʻdomain-sionalityʼ provides the opportunity to mix physicality and …","https://www.cambridge.org/core/services/aop-cambridge-core/content/view/0207DE9FA631E0225F40C540BFE40917/S2732527X22000372a.pdf/improving_mixedreality_prototyping_through_a_classification_and_characterisation_of_fidelity.pdf","https://scholar.google.com/scholar?q=related:QtV_JVCYizAJ:scholar.google.com/&scioq=mixed+reality&hl=en&as_sdt=0,5&as_ylo=2021&as_yhi=2023"
3,"Y Ham, DS Yang, Y Choi, JH Shin","The feasibility of mixed reality-based upper extremity self-training for patients with stroke—A pilot study",2022,"Frontiers in Neurology","frontiersin.org","https://www.frontiersin.org/articles/10.3389/fneur.2022.994586/full","https://scholar.google.com/scholar?cites=364023381074125891&as_sdt=2005&sciodt=0,5&hl=en",44,"2023-12-13 11:24:03","HTML","10.3389/fneur.2022.994586","","",,,,,3,3.00,1,4,1,"Mixed reality (MR), which combines virtual reality and tangible objects, can be used for repetitive training by patients with stroke, allowing them to be immersed in a virtual environment …","https://www.frontiersin.org/articles/10.3389/fneur.2022.994586/full","https://scholar.google.com/scholar?q=related:QyTcHlZFDQUJ:scholar.google.com/&scioq=mixed+reality&hl=en&as_sdt=0,5&as_ylo=2021&as_yhi=2023"
3,"C Portalés, J Gimeno, A Salvador…","Mixed Reality Annotation of Robotic-Assisted Surgery videos with real-time tracking and stereo matching",2023,"Computers & …","Elsevier","https://www.sciencedirect.com/science/article/pii/S0097849322002291","https://scholar.google.com/scholar?cites=16490609677358196474&as_sdt=2005&sciodt=0,5&hl=en",48,"2023-12-13 11:24:03","HTML","","","",,,,,3,3.00,1,4,1,"… Including virtual annotations in stereoscopic videos turns them into Mixed Reality (MR) … -rating method with an Oculus Quest 2 Virtual Reality device was performed, showing that the …","https://www.sciencedirect.com/science/article/pii/S0097849322002291","https://scholar.google.com/scholar?q=related:-uaNbCFq2uQJ:scholar.google.com/&scioq=mixed+reality&hl=en&as_sdt=0,5&as_ylo=2021&as_yhi=2023"
3,"X Cui, D Khan, Z He, Z Cheng","Fusing surveillance videos and three‐dimensional scene: A mixed reality system",2023,"Computer Animation and …","Wiley Online Library","https://onlinelibrary.wiley.com/doi/abs/10.1002/cav.2129","https://scholar.google.com/scholar?cites=4227155412417827668&as_sdt=2005&sciodt=0,5&hl=en",55,"2023-12-13 11:24:03","","10.1002/cav.2129","","",,,,,3,3.00,1,4,1,"… fusion and video recognition in the context of mixed reality and other real-time applications. … Their system not only helps in generic mixed reality application but also control the tunnel …","https://onlinelibrary.wiley.com/doi/pdf/10.1002/cav.2129","https://scholar.google.com/scholar?q=related:VNOIf3PfqToJ:scholar.google.com/&scioq=mixed+reality&hl=en&as_sdt=0,5&as_ylo=2021&as_yhi=2023"
3,"Y Buyruk, G Çağdaş","Interactive Parametric Design and Robotic Fabrication within Mixed Reality Environment",2022,"Applied Sciences","mdpi.com","https://www.mdpi.com/2076-3417/12/24/12797","https://scholar.google.com/scholar?cites=17537485770129015217&as_sdt=2005&sciodt=0,5&hl=en",56,"2023-12-13 11:24:03","HTML","","","",,,,,3,3.00,2,2,1,"… , and integrated within a mixed reality environment, where … steps was created within a mixed-reality environment. The … spatial feedback provided by mixed reality are richer than the …","https://www.mdpi.com/2076-3417/12/24/12797","https://scholar.google.com/scholar?q=related:sQEC7mOqYfMJ:scholar.google.com/&scioq=mixed+reality&hl=en&as_sdt=0,5&as_ylo=2021&as_yhi=2023"
3,"H Kase, J Nishizawa, K Tabata, K Takagi…","Spatial awareness application using mixed reality for 3D X-ray CT examination",2023,"Journal of …","iopscience.iop.org","https://iopscience.iop.org/article/10.1088/1748-0221/18/03/P03032/meta","https://scholar.google.com/scholar?cites=9663635763409261911&as_sdt=2005&sciodt=0,5&hl=en",57,"2023-12-13 11:24:03","","10.1088/1748-0221/18/03/P03032","","",,,,,3,3.00,1,5,1,"… However, augmented reality, virtual reality, and mixed reality are emerging as alternatives … In addition, it proposes a pointing system using motion capture and a spatial reality display. …","https://iopscience.iop.org/article/10.1088/1748-0221/18/03/P03032/pdf","https://scholar.google.com/scholar?q=related:VxXF1IYhHIYJ:scholar.google.com/&scioq=mixed+reality&hl=en&as_sdt=0,5&as_ylo=2021&as_yhi=2023"
3,"R Vishkaie, T Seyed, CT Emmons…","Understanding mixed reality interactions in a children's museum exhibition",2022,"Educational Media …","Taylor &Francis","https://www.tandfonline.com/doi/abs/10.1080/09523987.2021.1989764","https://scholar.google.com/scholar?cites=296686952935553075&as_sdt=2005&sciodt=0,5&hl=en",62,"2023-12-13 11:24:03","","10.1080/09523987.2021.1989764","","",,,,,3,3.00,1,4,1,"Socializing and interaction are important aspects for families who visit museums. Mixed reality (MR) uses a set of technologies that museums employ to encourage this behavior, but …","","https://scholar.google.com/scholar?q=related:M3g3NzYLHgQJ:scholar.google.com/&scioq=mixed+reality&hl=en&as_sdt=0,5&as_ylo=2021&as_yhi=2023"
3,"T Gregory, J Gregory, C Dacheux…","Surgeon experience of mixed reality headset technology during the COVID-19 pandemic: a multicenter international case series in orthopedic surgery",2022,"… Surgery, Interventions, & …","ncbi.nlm.nih.gov","https://www.ncbi.nlm.nih.gov/pmc/articles/PMC9130665/","https://scholar.google.com/scholar?cites=12024190301497983313&as_sdt=2005&sciodt=0,5&hl=en",64,"2023-12-13 11:24:03","HTML","","","",,,,,3,3.00,1,4,1,"… Mixed reality (MR) is a type of reality technology that allows for a digital image to be both superimposed and controlled by the user on top of their normal visual field. Using MR headsets…","https://www.ncbi.nlm.nih.gov/pmc/articles/PMC9130665/","https://scholar.google.com/scholar?q=related:UQF8UF-B3qYJ:scholar.google.com/&scioq=mixed+reality&hl=en&as_sdt=0,5&as_ylo=2021&as_yhi=2023"
3,"R Kirollos, M Harriott","Virtual Reality to Mixed Reality Graphic Conversion in Unity: Preliminary Guidelines and Graphic User Interface",2021,"International Conference on Human-Computer …","Springer","https://link.springer.com/chapter/10.1007/978-3-030-90176-9_46","https://scholar.google.com/scholar?cites=8996826310611899142&as_sdt=2005&sciodt=0,5&hl=en",68,"2023-12-13 11:24:03","","10.1007/978-3-030-90176-9_46","","",,,,,3,1.50,2,2,2,"… reality (VR) headsets are used primarily for training and simulation, while mixed reality (MR) … , and operational applications along an extended reality spectrum. In our future work, we are …","","https://scholar.google.com/scholar?q=related:BhPpvdwl23wJ:scholar.google.com/&scioq=mixed+reality&hl=en&as_sdt=0,5&as_ylo=2021&as_yhi=2023"
3,"A Knyazev, J Cheremukhina","Regulatory and Methodological Support for the Mixed Reality Technology in Education",2022,"2022 2nd International …","ieeexplore.ieee.org","https://ieeexplore.ieee.org/abstract/document/9801029/","https://scholar.google.com/scholar?cites=1423228235291542386&as_sdt=2005&sciodt=0,5&hl=en",74,"2023-12-13 11:24:03","","","","",,,,,3,3.00,2,2,1,"… mixed reality technology in education. The authors review the literature on the augmented reality technologies that can provide benefits compared to other technical solutions used in …","https://ieeexplore.ieee.org/iel7/9800942/9800943/09801029.pdf","https://scholar.google.com/scholar?q=related:csPbFopSwBMJ:scholar.google.com/&scioq=mixed+reality&hl=en&as_sdt=0,5&as_ylo=2021&as_yhi=2023"
3,"J Husár, L Knapcikova","Online and offline control of collaborative robot sused mixed reality",2021,"Acta Technol","researchgate.net","https://www.researchgate.net/profile/Jozef-Husar/publication/354686200_ONLINE_AND_OFFLINE_CONTROL_OF_COLLABORATIVE_ROBOTS_USED_MIXED_REALITY/links/6159edaa4a82eb7cb5f49976/ONLINE-AND-OFFLINE-CONTROL-OF-COLLABORATIVE-ROBOTS-USED-MIXED-REALITY.pdf?_sg%5B0%5D=started_experiment_milestone&origin=journalDetail","https://scholar.google.com/scholar?cites=4543140611676235324&as_sdt=2005&sciodt=0,5&hl=en",77,"2023-12-13 11:24:03","PDF","","","",,,,,3,1.50,2,2,2,"… reality allows you to insert objects into the real world using mobile and other devices. Mixed reality, also called mixed reality, is a … the already mentioned mixed reality about collaborative …","https://www.researchgate.net/profile/Jozef-Husar/publication/354686200_ONLINE_AND_OFFLINE_CONTROL_OF_COLLABORATIVE_ROBOTS_USED_MIXED_REALITY/links/6159edaa4a82eb7cb5f49976/ONLINE-AND-OFFLINE-CONTROL-OF-COLLABORATIVE-ROBOTS-USED-MIXED-REALITY.pdf?_sg%5B0%5D=started_experiment_milestone&origin=journalDetail","https://scholar.google.com/scholar?q=related:POac01B6DD8J:scholar.google.com/&scioq=mixed+reality&hl=en&as_sdt=0,5&as_ylo=2021&as_yhi=2023"
3,"B Emo, A Gerber, C Hölscher","User-centred spatial thinking in architectural design with mixed reality",2021,"… Conference, Novi Sad …","digitalcollection.zhaw.ch","https://digitalcollection.zhaw.ch/handle/11475/23145","https://scholar.google.com/scholar?cites=11022346953170241011&as_sdt=2005&sciodt=0,5&hl=en",89,"2023-12-13 11:24:03","","","","",,,,,3,1.50,1,3,2,"… merit of using mixed reality for user… mixed reality improved students` capacity to design from the users' perspective. While there is still much untapped potential for including mixed reality …","","https://scholar.google.com/scholar?q=related:80XSric-95gJ:scholar.google.com/&scioq=mixed+reality&hl=en&as_sdt=0,5&as_ylo=2021&as_yhi=2023"
3,"M Patel","EMERGING TRENDS OF IMMERSIVE MEDIA IN INDIA–AUGMENTED REALITY (AR), VIRTUAL REALITY (VR) AND MIXED REALITY (MR) CASE",2021,"DR. DY PATIL B-SCHOOL, PUNE, INDIA","academia.edu","https://www.academia.edu/download/68697632/Dr._D.Y.Patil_B_School_International_Conference_Proceedings.pdf#page=877","https://scholar.google.com/scholar?cites=6225023378937701472&as_sdt=2005&sciodt=0,5&hl=en",101,"2023-12-13 11:24:03","PDF","","","",,,,,3,1.50,3,1,2,"… of augmented and virtual reality. Physical world and virtual world can interact with each other in Mixed Reality. Microsoft HoloLens is the prime example of a mixed reality device. With …","https://www.academia.edu/download/68697632/Dr._D.Y.Patil_B_School_International_Conference_Proceedings.pdf#page=877","https://scholar.google.com/scholar?q=related:YGQVFMi5Y1YJ:scholar.google.com/&scioq=mixed+reality&hl=en&as_sdt=0,5&as_ylo=2021&as_yhi=2023"
3,"V Stifano, MC Palumbo, S Chidambaram…","The use of Mixed Reality for the treatment planning of unruptured intracranial aneurysms.",2021,"Journal of …","europepmc.org","https://europepmc.org/article/med/34342192","https://scholar.google.com/scholar?cites=18058954933194281786&as_sdt=2005&sciodt=0,5&hl=en",102,"2023-12-13 11:24:03","","","","",,,,,3,1.50,1,4,2,"… been raised towards extended reality, which comprises virtual, augmented, and mixed reality (MR) … A wearable mixed-reality device (HoloLens) was used to display and interact with a …","","https://scholar.google.com/scholar?q=related:OlPVz9RLnvoJ:scholar.google.com/&scioq=mixed+reality&hl=en&as_sdt=0,5&as_ylo=2021&as_yhi=2023"
3,"L Brägger, L Baumgartner…","Interaction and visualization design considerations for gaze-guided communication in collaborative extended reality",2022,"ISPRS Annals of …","isprs-annals.copernicus.org","https://isprs-annals.copernicus.org/articles/V-4-2022/205/2022/isprs-annals-V-4-2022-205-2022.html","https://scholar.google.com/scholar?cites=5059025152643238271&as_sdt=2005&sciodt=0,5&hl=en",148,"2023-12-13 11:24:03","","","","",,,,,3,3.00,1,3,1,"… 10f1 (Unity QA, 2020), and for the head-gaze prototypes and related interactive elements, we used the Mixed Reality Toolkit (MRTK) from Microsoft (Microsoft, 2021). We varied the …","https://isprs-annals.copernicus.org/articles/V-4-2022/205/2022/isprs-annals-V-4-2022-205-2022.pdf","https://scholar.google.com/scholar?q=related:fwkRjZJENUYJ:scholar.google.com/&scioq=mixed+reality&hl=en&as_sdt=0,5&as_ylo=2021&as_yhi=2023"
3,"Z Zhang","Building Symmetrical Reality Systems for Cooperative Manipulation",2023,"… IEEE Conference on Virtual Reality and 3D User …","ieeexplore.ieee.org","https://ieeexplore.ieee.org/abstract/document/10108724/","https://scholar.google.com/scholar?cites=16941012103190754747&as_sdt=2005&sciodt=0,5&hl=en",153,"2023-12-13 11:24:03","","","","",,,,,3,3.00,3,1,1,"… environment, which naturally creates a mixed reality environment of the physical and … reality with two different perception centers, and all of the mixed forms of physical and virtual reality …","","https://scholar.google.com/scholar?q=related:uzVHIsCQGusJ:scholar.google.com/&scioq=mixed+reality&hl=en&as_sdt=0,5&as_ylo=2021&as_yhi=2023"
3,"MH Yengui, C Stechert","On the activation of students through augmented reality experiences",2021,"Proceedings of the Design Society","cambridge.org","https://www.cambridge.org/core/journals/proceedings-of-the-design-society/article/on-the-activation-of-students-through-augmented-reality-experiences/2C3498A6F8A5CA629ADAFC09BAFE96DC","https://scholar.google.com/scholar?cites=4806182892156646805&as_sdt=2005&sciodt=0,5&hl=en",155,"2023-12-13 11:24:03","","","","",,,,,3,1.50,2,2,2,"… All kinds of Mixed Reality are increasingly used in industrial and social context, such as product development processes. Through Augmented Reality (AR) technology and the constant …","https://www.cambridge.org/core/services/aop-cambridge-core/content/view/2C3498A6F8A5CA629ADAFC09BAFE96DC/S2732527X21004922a.pdf/div-class-title-on-the-activation-of-students-through-augmented-reality-experiences-div.pdf","https://scholar.google.com/scholar?q=related:lXWOTOD9skIJ:scholar.google.com/&scioq=mixed+reality&hl=en&as_sdt=0,5&as_ylo=2021&as_yhi=2023"
3,"UH Govindarajan, D Zhang","Extended reality for patient recovery and wellness",2023,"Extended Reality for Healthcare Systems","Elsevier","https://www.sciencedirect.com/science/article/pii/B9780323983815000076","https://scholar.google.com/scholar?cites=3402515232518138692&as_sdt=2005&sciodt=0,5&hl=en",159,"2023-12-13 11:24:03","","","","",,,,,3,3.00,2,2,1,"… in healthcare systems, including advancements in immersive extended reality (XR). Virtual reality, augmented reality, and mixed reality are together referred to as XR or immersive XR. …","","https://scholar.google.com/scholar?q=related:RGsZoZMpOC8J:scholar.google.com/&scioq=mixed+reality&hl=en&as_sdt=0,5&as_ylo=2021&as_yhi=2023"
3,"L Wang, C Sandor","Can You Perceive the Size Change? Discrimination Thresholds for Size Changes in Augmented Reality",2021,"… Conference on Virtual Reality and Mixed Reality","Springer","https://link.springer.com/chapter/10.1007/978-3-030-90739-6_2","https://scholar.google.com/scholar?cites=12039244470267556370&as_sdt=2005&sciodt=0,5&hl=en",161,"2023-12-13 11:24:03","","10.1007/978-3-030-90739-6_2","","",,,,,3,1.50,2,2,2,"Existing psychophysical experiments show that size changes of objects could influence the human perception of objects properties (eg, shape or weight) in the physical surroundings. …","","https://scholar.google.com/scholar?q=related:EjJiHg_9E6cJ:scholar.google.com/&scioq=mixed+reality&hl=en&as_sdt=0,5&as_ylo=2021&as_yhi=2023"
3,"V Hui, T Estrina, G Zhou, A Huang","Applications of Extended Reality Technologies within Design Pedagogy: A Case Study in Architectural Science",2021,"International Journal of Digital …","academia.edu","https://www.academia.edu/download/91605565/Applications-of-Extended-Reality-Technologies-within-Design-Pedagogy.pdf","https://scholar.google.com/scholar?cites=6661599679960576763&as_sdt=2005&sciodt=0,5&hl=en",165,"2023-12-13 11:24:03","PDF","","","",,,,,3,1.50,1,4,2,"… This paper examines the possibilities of the incorporation of virtual reality, augmented reality, and mixed reality into the post-secondary architectural academic setting through lecture-…","https://www.academia.edu/download/91605565/Applications-of-Extended-Reality-Technologies-within-Design-Pedagogy.pdf","https://scholar.google.com/scholar?q=related:-_LnP53BclwJ:scholar.google.com/&scioq=mixed+reality&hl=en&as_sdt=0,5&as_ylo=2021&as_yhi=2023"
3,"T Kim, G Guida, D Kim","VitruviAR: Interactive Augmented Reality for Early Design Stage Applications",2021,"","papers.cumincad.org","http://papers.cumincad.org/data/works/att/sigradi2021_83.pdf","https://scholar.google.com/scholar?cites=15204468080196615863&as_sdt=2005&sciodt=0,5&hl=en",169,"2023-12-13 11:24:03","PDF","","","",,,,,3,1.50,1,3,2,"… The increasing development of Augmented Reality (AR) applications have found … on how the design cycle could be completed through mixed reality. In this paper we present VitruviAR, …","http://papers.cumincad.org/data/works/att/sigradi2021_83.pdf","https://scholar.google.com/scholar?q=related:t37ihikfAdMJ:scholar.google.com/&scioq=mixed+reality&hl=en&as_sdt=0,5&as_ylo=2021&as_yhi=2023"
3,"F Shirani","Integrating diversity in simulation‐based education: Potential role of virtual reality",2021,"AEM Education and Training","ncbi.nlm.nih.gov","https://www.ncbi.nlm.nih.gov/pmc/articles/PMC8194318/","https://scholar.google.com/scholar?cites=1176198491898147749&as_sdt=2005&sciodt=0,5&hl=en",193,"2023-12-13 11:24:03","","","","",,,,,3,1.50,3,1,2,"… Here is where virtual reality 2 can be tremendously helpful in … Virtual reality tools can also help recognizing and mitigating … virtual‐, augmented‐, and mixed‐reality techniques can help …","","https://scholar.google.com/scholar?q=related:pXPw7kuyUhAJ:scholar.google.com/&scioq=mixed+reality&hl=en&as_sdt=0,5&as_ylo=2021&as_yhi=2023"
2,"V Barrile, E Bernardo, A Fotia, G Bilotta","A Combined Study of Cultural Heritage in Archaeological Museums: 3D Survey and Mixed Reality. Heritage 2022, 5, 1330–1349",2022,"","academia.edu","https://www.academia.edu/download/92784012/pdf.pdf","https://scholar.google.com/scholar?cites=12527209837720812290&as_sdt=2005&sciodt=0,5&hl=en",51,"2023-12-13 11:24:03","PDF","","","",,,,,2,2.00,1,4,1,"… Tools and libraries for virtual, augmented, and mixed reality content have recently become … building information models, virtual and augmented reality) allowing the choice of different 3D …","https://www.academia.edu/download/92784012/pdf.pdf","https://scholar.google.com/scholar?q=related:ArsgtPmW2a0J:scholar.google.com/&scioq=mixed+reality&hl=en&as_sdt=0,5&as_ylo=2021&as_yhi=2023"
2,"L Bondurant, D Reinholz","“Rahul is a Math Nerd” and “Mia Can Be a Drama Queen”: How Mixed-Reality Simulations Can Perpetuate Racist and Sexist Stereotypes",2023,"Mathematics Teacher Educator","pubs.nctm.org","https://pubs.nctm.org/view/journals/mte/11/3/article-p189.xml","https://scholar.google.com/scholar?cites=480963919605706558&as_sdt=2005&sciodt=0,5&hl=en",53,"2023-12-13 11:24:03","","","","",,,,,2,2.00,1,2,1,"… with a popular simulations platform, which creates mixed-reality simulations of five digital avatars … Here, we focus on mixed-reality simulations, comprising a PT leading a discussion with …","","https://scholar.google.com/scholar?q=related:Pq_g-SK6rAYJ:scholar.google.com/&scioq=mixed+reality&hl=en&as_sdt=0,5&as_ylo=2021&as_yhi=2023"
2,"CY Tseng, Y Shu, TC Huang, WC Hsu…","Integration of Mixed Reality in Teaching and Learning Effectiveness: A Systematic Literature Review of the Analyses",2021,"… and Learning: 4th …","Springer","https://link.springer.com/chapter/10.1007/978-3-030-91540-7_10","https://scholar.google.com/scholar?cites=2113122993366393488&as_sdt=2005&sciodt=0,5&hl=en",65,"2023-12-13 11:24:03","","10.1007/978-3-030-91540-7_10","","",,,,,2,1.00,0,5,2,"… In this study, a literature review was conducted on the trends in applying mixed reality (MR) … In addition, relevant suggestions for mixed reality in education future research are proposed…","","https://scholar.google.com/scholar?q=related:kGJQqipSUx0J:scholar.google.com/&scioq=mixed+reality&hl=en&as_sdt=0,5&as_ylo=2021&as_yhi=2023"
2,"R Kirollos, W Merchant","Comparing cybersickness in virtual reality and mixed reality head-mounted displays",2023,"Frontiers in Virtual Reality","frontiersin.org","https://www.frontiersin.org/articles/10.3389/frvir.2023.1130864/full","https://scholar.google.com/scholar?cites=13472500628260641510&as_sdt=2005&sciodt=0,5&hl=en",66,"2023-12-13 11:24:03","HTML","10.3389/frvir.2023.1130864","","",,,,,2,2.00,1,2,1,"… in two Mixed Reality conditions and one Virtual reality condition. … in the first Mixed Reality condition (called ‘Mixed Reality’ … the second Mixed Reality condition (called ‘Mixed Reality +’ …","https://www.frontiersin.org/articles/10.3389/frvir.2023.1130864/full","https://scholar.google.com/scholar?q=related:5tqz5_Dv97oJ:scholar.google.com/&scioq=mixed+reality&hl=en&as_sdt=0,5&as_ylo=2021&as_yhi=2023"
