Cites,Authors,Title,Year,Source,Publisher,ArticleURL,CitesURL,GSRank,QueryDate,Type,DOI,ISSN,CitationURL,Volume,Issue,StartPage,EndPage,ECC,CitesPerYear,CitesPerAuthor,AuthorCount,Age,Abstract,FullTextURL,RelatedURL
17,"S Patel, B Panchotiya, A Patel, A Budharani…","A Survey: Virtual, Augmented and Mixed Reality in Education",2020,"International Journal of …","academia.edu","https://www.academia.edu/download/63534129/a-survey-virtual-augmented-and-mixed-IJERTV9IS05065220200605-106458-k0hlnt.pdf","https://scholar.google.com/scholar?cites=10227241969996125302&as_sdt=2005&sciodt=0,5&hl=en",345,"2023-12-13 12:37:33","PDF","","","",,,,,17,5.67,3,5,3,"… This manuscript defines the overview of virtual reality, augmented reality and mixed reality and how people are able to experience these technologies using devices. In addition, it also …","https://www.academia.edu/download/63534129/a-survey-virtual-augmented-and-mixed-IJERTV9IS05065220200605-106458-k0hlnt.pdf","https://scholar.google.com/scholar?q=related:dtSVrWJ27o0J:scholar.google.com/&scioq=intitle:mixed+intitle:reality&hl=en&as_sdt=0,5&as_ylo=2003&as_yhi=2023"
17,"B John, N Wickramasinghe","A review of mixed reality in Health Care",2020,"… Health and Wellness Management with IoT …","Springer","https://link.springer.com/chapter/10.1007/978-3-030-17347-0_18","https://scholar.google.com/scholar?cites=15698798077092021132&as_sdt=2005&sciodt=0,5&hl=en",348,"2023-12-13 12:37:33","","10.1007/978-3-030-17347-0_18","","",,,,,17,5.67,9,2,3,"… We used the terms ‘virtual reality’, ‘augmented reality’ and ‘mixed reality’ to search in the … the maximum number of articles related to augmented reality. We went through the papers and …","https://www.academia.edu/download/62269034/Wickramasinghe__Rasmussen_welness_with_IoT_202020200304-80627-166uif9.pdf#page=393","https://scholar.google.com/scholar?q=related:jMOn4axV3dkJ:scholar.google.com/&scioq=intitle:mixed+intitle:reality&hl=en&as_sdt=0,5&as_ylo=2003&as_yhi=2023"
17,"X Pan, M Zheng, X Xu, AG Campbell","Knowing your student: Targeted teaching decision support through asymmetric mixed reality collaborative learning",2021,"IEEE Access","ieeexplore.ieee.org","https://ieeexplore.ieee.org/abstract/document/9645428/","https://scholar.google.com/scholar?cites=11199393410844723784&as_sdt=2005&sciodt=0,5&hl=en",544,"2023-12-13 12:37:33","","","","",,,,,17,8.50,4,4,2,"… of different technologies covering the full Milgram’s Mixed Reality continuum [10], asymmetric … Therefore, based on the prior Mixed Reality collaborative learning system METAL [6], this …","https://ieeexplore.ieee.org/iel7/6287639/9312710/09645428.pdf","https://scholar.google.com/scholar?q=related:SApAYfg8bJsJ:scholar.google.com/&scioq=intitle:mixed+intitle:reality&hl=en&as_sdt=0,5&as_ylo=2003&as_yhi=2023"
17,"ACC Reyes, NPA Del Gallego, JAP Deja","Mixed reality guidance system for motherboard assembly using tangible augmented reality",2020,"… and Augmented Reality …","dl.acm.org","https://dl.acm.org/doi/abs/10.1145/3385378.3385379","https://scholar.google.com/scholar?cites=1860713288711876317&as_sdt=2005&sciodt=0,5&hl=en",639,"2023-12-13 12:37:33","","10.1145/3385378.3385379","","",,,,,17,5.67,6,3,3,"… developed a mixed reality guidance system (MRGS) for motherboard assembly with purpose of exploring the usability and viability of using mixed reality and tangible augmented reality (…","https://dl.acm.org/doi/pdf/10.1145/3385378.3385379","https://scholar.google.com/scholar?q=related:3S6FquCU0hkJ:scholar.google.com/&scioq=intitle:mixed+intitle:reality&hl=en&as_sdt=0,5&as_ylo=2003&as_yhi=2023"
17,"P Raimbaud, R Lou, F Merienne…","BIM-based mixed reality application for supervision of construction",2019,"… Reality and 3D User …","ieeexplore.ieee.org","https://ieeexplore.ieee.org/abstract/document/8797784/","https://scholar.google.com/scholar?cites=10448645785511076192&as_sdt=2005&sciodt=0,5&hl=en",668,"2023-12-13 12:37:33","","","","",,,,,17,4.25,4,4,4,"… This paper presents a mixed reality (MR) application based on BIM data and drone videos, allowing off-site construction supervision. It permits to maNe annotations about differences …","https://ieeexplore.ieee.org/iel7/8787730/8797678/08797784.pdf","https://scholar.google.com/scholar?q=related:YCFFjfsLAZEJ:scholar.google.com/&scioq=intitle:mixed+intitle:reality&hl=en&as_sdt=0,5&as_ylo=2003&as_yhi=2023"
17,"A Steed, J MacColl, C Randell, B Brown…","Models of space in a mixed-reality system",2004,"… , 2004. IV 2004.","ieeexplore.ieee.org","https://ieeexplore.ieee.org/abstract/document/1320228/","https://scholar.google.com/scholar?cites=17716289623251575154&as_sdt=2005&sciodt=0,5&hl=en",677,"2023-12-13 12:37:33","","","","",,,,,17,0.89,3,5,19,"… While our user studies [4] confirm that users of mixed reality systems can overcome minor ambiguities or inconsistencies through talk and other shared resources, major inconsistencies …","https://ieeexplore.ieee.org/iel5/9225/29243/01320228.pdf","https://scholar.google.com/scholar?q=related:cmHZI4zn3PUJ:scholar.google.com/&scioq=intitle:mixed+intitle:reality&hl=en&as_sdt=0,5&as_ylo=2003&as_yhi=2023"
17,"A Genovese, G Zalles, G Reardon…","Acoustic perturbations in HRTFs measured on mixed reality headsets",2018,"… and Augmented Reality","aes.org","https://www.aes.org/e-lib/online/browse.cfm?elib=19699","https://scholar.google.com/scholar?cites=6087125037584674963&as_sdt=2005&sciodt=0,5&hl=en",683,"2023-12-13 12:37:33","","","","",,,,,17,3.40,4,4,5,"… Mounted Displays for Mixed and Augmented Reality has been measured via a dummy head mannequin. Such spectral distortions may be relevant for mixed reality environments where …","https://www.researchgate.net/profile/Andrea-Genovese-2/publication/336371102_Acoustic_perturbations_in_HRTFs_measured_on_Mixed_Reality_Headsets/links/5d9e64da92851cce3c90fbab/Acoustic-perturbations-in-HRTFs-measured-on-Mixed-Reality-Headsets.pdf","https://scholar.google.com/scholar?q=related:k_CegPjPeVQJ:scholar.google.com/&scioq=intitle:mixed+intitle:reality&hl=en&as_sdt=0,5&as_ylo=2003&as_yhi=2023"
17,"Y Yamada, K Irie, K Gushima, F Ishizawa…","HoloMoL: human memory augmentation with mixed-reality technologies",2017,"Proceedings of the 21st …","dl.acm.org","https://dl.acm.org/doi/abs/10.1145/3131085.3131097","https://scholar.google.com/scholar?cites=11234441630018907027&as_sdt=2005&sciodt=0,5&hl=en",714,"2023-12-13 12:37:33","","10.1145/3131085.3131097","","",,,,,17,2.83,3,5,6,"HoloMoL is a platform that helps us memorize different types of information by combining the method of loci memorization technique and mixed reality contents delivered through …","https://dl.acm.org/doi/pdf/10.1145/3131085.3131097","https://scholar.google.com/scholar?q=related:kysjzyPB6JsJ:scholar.google.com/&scioq=intitle:mixed+intitle:reality&hl=en&as_sdt=0,5&as_ylo=2003&as_yhi=2023"
17,"J Morales-Mere, JJ Chessa…","Mixed Reality System for Education and Innovation in Prehospital Interventions at Peruvian Fire Department",2020,"2020 IEEE XXVII …","ieeexplore.ieee.org","https://ieeexplore.ieee.org/abstract/document/9220259/","https://scholar.google.com/scholar?cites=4181830496912935994&as_sdt=2005&sciodt=0,5&hl=en",735,"2023-12-13 12:37:33","","","","",,,,,17,5.67,6,3,3,"… The equipment included a control system, a trauma simulator-manikin, a mixed reality … network between the visual interface of the Mixed Reality System (MRS) software and a fuzzy logic …","https://ieeexplore.ieee.org/iel7/9214790/9220007/09220259.pdf","https://scholar.google.com/scholar?q=related:OgxkP67YCDoJ:scholar.google.com/&scioq=intitle:mixed+intitle:reality&hl=en&as_sdt=0,5&as_ylo=2003&as_yhi=2023"
17,"P Anders, W Lonsing","AmbiViewer: a tool for creating architectural mixed reality",2005,"… of the 2005 Annual Conference of the …","papers.cumincad.org","http://papers.cumincad.org/data/works/att/2005_acadia05_book.pdf#page=104","https://scholar.google.com/scholar?cites=1454034102693521189&as_sdt=2005&sciodt=0,5&hl=en",749,"2023-12-13 12:37:33","PDF","","","",,,,,17,0.94,9,2,18,"… This paper presents a new mixed reality system for architecture, AmbiViewer. The system … cybrids, compositions of virtual and material reality. The paper concludes with a description of …","http://papers.cumincad.org/data/works/att/2005_acadia05_book.pdf#page=104","https://scholar.google.com/scholar?q=related:JedZBlDELRQJ:scholar.google.com/&scioq=intitle:mixed+intitle:reality&hl=en&as_sdt=0,5&as_ylo=2003&as_yhi=2023"
17,"SL Perkins, B Krajancich, CFJ Yang…","A patient-specific mixed-reality visualization tool for thoracic surgical planning",2020,"The Annals of thoracic …","Elsevier","https://www.sciencedirect.com/science/article/pii/S0003497520302782","https://scholar.google.com/scholar?cites=1484832226600344986&as_sdt=2005&sciodt=0,5&hl=en",762,"2023-12-13 12:37:33","","","","",,,,,17,5.67,4,4,3,"… Mixed reality enables the display of digital objects superimposed on the real world and can … In this work, we present a mixed-reality tool for the fast, cost-effective display of a patient’s …","","https://scholar.google.com/scholar?q=related:mt2QCQsvmxQJ:scholar.google.com/&scioq=intitle:mixed+intitle:reality&hl=en&as_sdt=0,5&as_ylo=2003&as_yhi=2023"
17,"SM Martin","Artificial intelligence, mixed reality, and the redefinition of the classroom",2019,"","books.google.com","https://books.google.com/books?hl=en&lr=&id=b-mUDwAAQBAJ&oi=fnd&pg=PR9&dq=mixed+reality&ots=EFJazM1w7H&sig=eI_DTt8iVdJECZMRZ0GTt7VsDfs","https://scholar.google.com/scholar?cites=4633703960016290291&as_sdt=2005&sciodt=0,5&hl=en",764,"2023-12-13 12:37:33","BOOK","","","",,,,,17,4.25,17,1,4,"… Many dreamers imagined the day when learning systems would truly become personalized, intuitively adapting to learner needs, and mixed reality would be available in every …","","https://scholar.google.com/scholar?q=related:84EXgzM5TkAJ:scholar.google.com/&scioq=intitle:mixed+intitle:reality&hl=en&as_sdt=0,5&as_ylo=2003&as_yhi=2023"
17,"J Chalhoub, S Alsafouri, SK Ayer","Leveraging site survey points for mixed reality BIM visualization",2018,"… Research Congress 2018","ascelibrary.org","https://ascelibrary.org/doi/abs/10.1061/9780784481264.032","https://scholar.google.com/scholar?cites=15884580542415854241&as_sdt=2005&sciodt=0,5&hl=en",769,"2023-12-13 12:37:33","","10.1061/9780784481264.032","","",,,,,17,3.40,6,3,5,"… Furthermore, researchers have experimented with using virtual reality (VR) and mixed reality (MR) to visualize the design overlaid on existing features in its final intended location on site…","","https://scholar.google.com/scholar?q=related:oVrH3NddcdwJ:scholar.google.com/&scioq=intitle:mixed+intitle:reality&hl=en&as_sdt=0,5&as_ylo=2003&as_yhi=2023"
17,"AK Bhowmik","Advances in virtual, augmented, and mixed reality technologies",2018,"Information Display","Wiley Online Library","https://sid.onlinelibrary.wiley.com/doi/abs/10.1002/j.2637-496X.2018.tb01117.x","https://scholar.google.com/scholar?cites=1354678063343446879&as_sdt=2005&sciodt=0,5&hl=en",778,"2023-12-13 12:37:33","","10.1002/j.2637-496X.2018.tb01117.x","","",,,,,17,3.40,17,1,5,"Virtual, augmented, and mixed reality (VR/AR/MR) technologies offer the promise of seamlessly blending the real and the virtual worlds, thereby enabling many exciting immersive and …","https://sid.onlinelibrary.wiley.com/doi/pdf/10.1002/j.2637-496X.2018.tb01117.x","https://scholar.google.com/scholar?q=related:X6uZboXIzBIJ:scholar.google.com/&scioq=intitle:mixed+intitle:reality&hl=en&as_sdt=0,5&as_ylo=2003&as_yhi=2023"
17,"T Williams, D Szafir, T Chakraborti, HB Amor","The 1st international workshop on virtual, augmented, and mixed reality for human-robot interaction",2018,"AI Magazine","ojs.aaai.org","https://ojs.aaai.org/aimagazine/index.php/aimagazine/article/view/2822","https://scholar.google.com/scholar?cites=15598289828327597263&as_sdt=2005&sciodt=0,5&hl=en",807,"2023-12-13 12:37:33","","","","",,,,,17,3.40,4,4,5,"… and Mixed Reality in order to identify challenges in mixed reality interactions between humans and robots. This inaugural workshop featured a keynote talk from Blair MacIntyre (Mozilla, …","https://ojs.aaai.org/aimagazine/index.php/aimagazine/article/view/2822/2743","https://scholar.google.com/scholar?q=related:zyQOofRBeNgJ:scholar.google.com/&scioq=intitle:mixed+intitle:reality&hl=en&as_sdt=0,5&as_ylo=2003&as_yhi=2023"
17,"GB Mo, JJ Dudley, PO Kristensson","Gesture knitter: A hand gesture design tool for head-mounted mixed reality applications",2021,"… of the 2021 CHI Conference on …","dl.acm.org","https://dl.acm.org/doi/abs/10.1145/3411764.3445766","https://scholar.google.com/scholar?cites=6316943476963404576&as_sdt=2005&sciodt=0,5&hl=en",824,"2023-12-13 12:37:33","","10.1145/3411764.3445766","","",,,,,17,8.50,6,3,2,"… The emerging potential of head-mounted mixed reality … problem for a 3D mixed reality environment. Two central … of novel hand gestures in a mixed reality setting with high data efciency. …","https://dl.acm.org/doi/pdf/10.1145/3411764.3445766","https://scholar.google.com/scholar?q=related:IOufqp9KqlcJ:scholar.google.com/&scioq=intitle:mixed+intitle:reality&hl=en&as_sdt=0,5&as_ylo=2003&as_yhi=2023"
17,"HN Sharma, PO Toups Dugas, I Dolgov…","Evaluating display modalities using a mixed reality game",2016,"Proceedings of the …","dl.acm.org","https://dl.acm.org/doi/abs/10.1145/2967934.2968090","https://scholar.google.com/scholar?cites=1979965857500182655&as_sdt=2005&sciodt=0,5&hl=en",848,"2023-12-13 12:37:33","","10.1145/2967934.2968090","","",,,,,17,2.43,4,4,7,"… We design and study a mixed reality game, PhotoNav, to investigate wearable computing … in designing mixed reality games and interfaces that require users to split their attention. …","https://dl.acm.org/doi/pdf/10.1145/2967934.2968090","https://scholar.google.com/scholar?q=related:fzizA3VAehsJ:scholar.google.com/&scioq=intitle:mixed+intitle:reality&hl=en&as_sdt=0,5&as_ylo=2003&as_yhi=2023"
17,"Y Pan, D Sinclair, K Mitchell","Empowerment and embodiment for collaborative mixed reality systems",2018,"Computer Animation and Virtual …","Wiley Online Library","https://onlinelibrary.wiley.com/doi/abs/10.1002/cav.1838","https://scholar.google.com/scholar?cites=16234880801995545441&as_sdt=2005&sciodt=0,5&hl=en",860,"2023-12-13 12:37:33","","10.1002/cav.1838","","",,,,,17,3.40,6,3,5,"We present several mixed‐reality‐based remote collaboration settings by using consumer head‐mounted displays. We investigated how two people are able to work together in these …","https://onlinelibrary.wiley.com/doi/pdf/10.1002/cav.1838","https://scholar.google.com/scholar?q=related:YdvAxRLiTeEJ:scholar.google.com/&scioq=intitle:mixed+intitle:reality&hl=en&as_sdt=0,5&as_ylo=2003&as_yhi=2023"
17,"PD Ritsos, J Mearman, J Jackson…","Synthetic visualizations in web-based mixed reality",2017,"… Technologies for Data …","research.bangor.ac.uk","https://research.bangor.ac.uk/portal/en/researchoutputs/synthetic-visualizations-in-webbased-mixed-reality(51619107-d592-41fd-8a0b-5c8420860e5e).html","https://scholar.google.com/scholar?cites=17447755868988738990&as_sdt=2005&sciodt=0,5&hl=en",861,"2023-12-13 12:37:33","","","","",,,,,17,2.83,4,4,6,"… We visualize said data in Mixed Reality (MR), using emerging web-technologies and open-… the concept of synthetic visualizations in mixed reality. Our prototype uses a combination of …","https://research.bangor.ac.uk/portal/files/28624180/Ritsos_et_al_IAW_2017.pdf","https://scholar.google.com/scholar?q=related:ro3PSoXhIvIJ:scholar.google.com/&scioq=intitle:mixed+intitle:reality&hl=en&as_sdt=0,5&as_ylo=2003&as_yhi=2023"
17,"A Croatti, A Ricci","A model and platform for building agent-based pervasive mixed reality systems",2018,"Advances in Practical Applications of Agents, Multi …","Springer","https://link.springer.com/chapter/10.1007/978-3-319-94580-4_10","https://scholar.google.com/scholar?cites=7872546320677991692&as_sdt=2005&sciodt=0,5&hl=en",873,"2023-12-13 12:37:33","","10.1007/978-3-319-94580-4_10","","",,,,,17,3.40,9,2,5,"In agent literature, a partially unexplored area is related to the integration of ever-wider opportunities offered by technologies such as Mixed Reality (MR) and Augmented Reality (AR). …","","https://scholar.google.com/scholar?q=related:DPXRCSvnQG0J:scholar.google.com/&scioq=intitle:mixed+intitle:reality&hl=en&as_sdt=0,5&as_ylo=2003&as_yhi=2023"
17,"J Amores, J Lanier","HoloARt: painting with holograms in mixed reality",2017,"Proceedings of the 2017 CHI Conference Extended …","dl.acm.org","https://dl.acm.org/doi/abs/10.1145/3027063.3050435","https://scholar.google.com/scholar?cites=328262756145529953&as_sdt=2005&sciodt=0,5&hl=en",875,"2023-12-13 12:37:33","","10.1145/3027063.3050435","","",,,,,17,2.83,9,2,6,"… Tilt Brush [1] uses Virtual Reality and external sensors to create a space in which the user is … creating a new media art that uses mixed reality and holograms for purely artistic purposes. …","https://dl.acm.org/doi/pdf/10.1145/3027063.3050435","https://scholar.google.com/scholar?q=related:YYQLzTw5jgQJ:scholar.google.com/&scioq=intitle:mixed+intitle:reality&hl=en&as_sdt=0,5&as_ylo=2003&as_yhi=2023"
17,"V Stantchev","Enhancing health-care services with mixed reality systems",2010,"The Engineering of Mixed Reality Systems","Springer","https://link.springer.com/chapter/10.1007/978-1-84882-733-2_17","https://scholar.google.com/scholar?cites=15189174853933379955&as_sdt=2005&sciodt=0,5&hl=en",885,"2023-12-13 12:37:33","","10.1007/978-1-84882-733-2_17","","",,,,,17,1.31,17,1,13,"… This work presents a development approach for mixed reality … Mixed reality systems can help fill the gap between highly … that can benefit from mixed reality systems. The result is a …","https://www.researchgate.net/profile/Vladimir-Stantchev/publication/226908098_Enhancing_Health-Care_Services_with_Mixed_Reality_Systems/links/5673f40e08aedbbb3fa1a498/Enhancing-Health-Care-Services-with-Mixed-Reality-Systems.pdf","https://scholar.google.com/scholar?q=related:c7H-zw3KytIJ:scholar.google.com/&scioq=intitle:mixed+intitle:reality&hl=en&as_sdt=0,5&as_ylo=2003&as_yhi=2023"
17,"J Hochberg, C Vogel, T Bastiaens","Gestaltung und Erforschung eines Mixed-Reality-Lernsystems",2017,"… : Zeitschrift für Theorie und …","medienpaed.com","https://www.medienpaed.com/article/view/476","https://scholar.google.com/scholar?cites=14877208800537200485&as_sdt=2005&sciodt=0,5&hl=en",998,"2023-12-13 12:37:33","","","","",,,,,17,2.83,6,3,6,"In diesem Artikel wird ein Entwurf eines Lernsystems vorgestellt, in welchem Mixed-Reality (MR) Technologien und didaktischen Modelle für den Einsatz in der industriellen …","https://www.medienpaed.com/article/download/476/459","https://scholar.google.com/scholar?q=related:ZcdVzZR2ds4J:scholar.google.com/&scioq=intitle:mixed+intitle:reality&hl=en&as_sdt=0,5&as_ylo=2003&as_yhi=2023"
16,"A Brunzini, A Papetti, D Messi, M Germani","A comprehensive method to design and assess mixed reality simulations",2022,"Virtual Reality","Springer","https://link.springer.com/article/10.1007/s10055-022-00632-8","https://scholar.google.com/scholar?cites=1422643355724640243&as_sdt=2005&sciodt=0,5&hl=en",144,"2023-12-13 12:37:33","HTML","10.1007/s10055-022-00632-8","","",,,,,16,16.00,4,4,1,"The scientific literature highlights how Mixed Reality (MR) simulations allow obtaining several benefits in healthcare education. Simulation-based training, boosted by MR, offers an …","https://link.springer.com/article/10.1007/s10055-022-00632-8","https://scholar.google.com/scholar?q=related:828JNJg-vhMJ:scholar.google.com/&scioq=intitle:mixed+intitle:reality&hl=en&as_sdt=0,5&as_ylo=2003&as_yhi=2023"
16,"T Basu, O Bannova, JD Camba","Mixed reality architecture in space habitats",2021,"Acta Astronautica","Elsevier","https://www.sciencedirect.com/science/article/pii/S0094576520305750","https://scholar.google.com/scholar?cites=18283006873096213141&as_sdt=2005&sciodt=0,5&hl=en",158,"2023-12-13 12:37:33","HTML","","","",,,,,16,8.00,5,3,2,"… In this paper, we describe how Mixed Reality technologies can help the crew to adapt to confinement and limitations of space habitats as well as mitigate the negative impact of sensory …","https://www.sciencedirect.com/science/article/pii/S0094576520305750","https://scholar.google.com/scholar?q=related:ldLsMOJJuv0J:scholar.google.com/&scioq=intitle:mixed+intitle:reality&hl=en&as_sdt=0,5&as_ylo=2003&as_yhi=2023"
16,"DK Baroroh, CH Chu","Human-centric production system simulation in mixed reality: an exemplary case of logistic facility design",2022,"Journal of Manufacturing Systems","Elsevier","https://www.sciencedirect.com/science/article/pii/S0278612522001479","https://scholar.google.com/scholar?cites=15947466909405467614&as_sdt=2005&sciodt=0,5&hl=en",401,"2023-12-13 12:37:33","HTML","","","",,,,,16,16.00,8,2,1,"… Hence, this research proposes a novel idea of production system simulation in mixed reality … in the facility to reach a new target created by mixed-model production, while the operator …","https://www.sciencedirect.com/science/article/pii/S0278612522001479","https://scholar.google.com/scholar?q=related:3tNoKqnIUN0J:scholar.google.com/&scioq=intitle:mixed+intitle:reality&hl=en&as_sdt=0,5&as_ylo=2003&as_yhi=2023"
16,"P Caligiana, A Liverani, A Ceruti, GM Santi, G Donnici…","An interactive real-time cutting technique for 3D models in mixed reality",2020,"Technologies","mdpi.com","https://www.mdpi.com/2227-7080/8/2/23","https://scholar.google.com/scholar?cites=14715193227156775139&as_sdt=2005&sciodt=0,5&hl=en",467,"2023-12-13 12:37:33","","","","",,,,,16,5.33,3,6,3,"… This work describes a Mixed Reality application useful to modify and cut virtual objects. A … solutions of the preoperative stage in a Mixed Reality environment. High precision in surgery …","https://www.mdpi.com/2227-7080/8/2/23/pdf","https://scholar.google.com/scholar?q=related:4-DpkUbeNswJ:scholar.google.com/&scioq=intitle:mixed+intitle:reality&hl=en&as_sdt=0,5&as_ylo=2003&as_yhi=2023"
16,"G Hadjidemetriou, M Belk, C Fidas…","Picture passwords in mixed reality: Implementation and evaluation",2019,"Extended Abstracts of the …","dl.acm.org","https://dl.acm.org/doi/abs/10.1145/3290607.3313076","https://scholar.google.com/scholar?cites=10106103446733283067&as_sdt=2005&sciodt=0,5&hl=en",553,"2023-12-13 12:37:33","","10.1145/3290607.3313076","","",,,,,16,4.00,4,4,4,"… We present HoloPass, a mixed reality application for the … of picture passwords for mixed reality environments, and … aspects of picture passwords in mixed reality vs. traditional desktop …","https://dl.acm.org/doi/pdf/10.1145/3290607.3313076","https://scholar.google.com/scholar?q=related:-17jVYoXQIwJ:scholar.google.com/&scioq=intitle:mixed+intitle:reality&hl=en&as_sdt=0,5&as_ylo=2003&as_yhi=2023"
16,"ZN Tang, LH Hu, HY Soh, Y Yu, WB Zhang…","Accuracy of mixed reality combined with surgical navigation assisted oral and maxillofacial tumor resection",2022,"Frontiers in …","frontiersin.org","https://www.frontiersin.org/articles/10.3389/fonc.2021.715484/full","https://scholar.google.com/scholar?cites=9069895890934546607&as_sdt=2005&sciodt=0,5&hl=en",570,"2023-12-13 12:37:33","HTML","10.3389/fonc.2021.715484","","",,,,,16,16.00,3,6,1,"… Through IGT-Link port, mixed reality workstation was synchronized with … mixed reality workstation. Osteotomy lines were marked with the aid of both surgical navigation and mixed reality …","https://www.frontiersin.org/articles/10.3389/fonc.2021.715484/full","https://scholar.google.com/scholar?q=related:r8DtKEK-3n0J:scholar.google.com/&scioq=intitle:mixed+intitle:reality&hl=en&as_sdt=0,5&as_ylo=2003&as_yhi=2023"
16,"U Zaldívar-Colado, S Garbaya…","A mixed reality for virtual assembly",2017,"2017 26th IEEE …","ieeexplore.ieee.org","https://ieeexplore.ieee.org/abstract/document/8172385/","https://scholar.google.com/scholar?cites=6477896040149911121&as_sdt=2005&sciodt=0,5&hl=en",571,"2023-12-13 12:37:33","","","","",,,,,16,2.67,5,3,6,"… presents a mixed reality system that integrates virtual assembly environment with augmented reality. This … The evaluation of this Mixed Reality approach showed a statistically significant …","https://ieeexplore.ieee.org/iel7/8116593/8172268/08172385.pdf","https://scholar.google.com/scholar?q=related:UYYLjSAc5lkJ:scholar.google.com/&scioq=intitle:mixed+intitle:reality&hl=en&as_sdt=0,5&as_ylo=2003&as_yhi=2023"
16,"A Morris, J Guan, N Lessio…","Toward mixed reality hybrid objects with iot avatar agents",2020,"2020 IEEE International …","ieeexplore.ieee.org","https://ieeexplore.ieee.org/abstract/document/9282914/","https://scholar.google.com/scholar?cites=4008700006621365503&as_sdt=2005&sciodt=0,5&hl=en",601,"2023-12-13 12:37:33","","","","",,,,,16,5.33,4,4,3,"… This work addresses this by applying mixed reality toward … on IoT Avatars (mixed reality character representations of physical … This contributes i) an exploration of mixed reality for smart …","https://ieeexplore.ieee.org/iel7/9282733/9282811/09282914.pdf","https://scholar.google.com/scholar?q=related:_8TFwWrDoTcJ:scholar.google.com/&scioq=intitle:mixed+intitle:reality&hl=en&as_sdt=0,5&as_ylo=2003&as_yhi=2023"
