Cites,Authors,Title,Year,Source,Publisher,ArticleURL,CitesURL,GSRank,QueryDate,Type,DOI,ISSN,CitationURL,Volume,Issue,StartPage,EndPage,ECC,CitesPerYear,CitesPerAuthor,AuthorCount,Age,Abstract,FullTextURL,RelatedURL
2,"C Vazquez, N Tan, S Sadalgi","Home Studio: DIY Interior Design in Mixed Reality",2021,"ACM SIGGRAPH 2021 Immersive …","dl.acm.org","https://dl.acm.org/doi/abs/10.1145/3450615.3464528","https://scholar.google.com/scholar?cites=13278872445964788654&as_sdt=2005&sciodt=0,5&hl=en",78,"2023-12-13 11:24:03","","10.1145/3450615.3464528","","",,,,,2,1.00,1,3,2,"… In this work, we present Home Studio, a mixed reality design tool for home staging. Our tool … sense of presence for prospective buyers with an accompanying virtual reality experience. …","https://dl.acm.org/doi/pdf/10.1145/3450615.3464528","https://scholar.google.com/scholar?q=related:riN0lyIISLgJ:scholar.google.com/&scioq=mixed+reality&hl=en&as_sdt=0,5&as_ylo=2021&as_yhi=2023"
2,"W Guo, X Wang, Z Deng, H Li","A Civil Aircraft Cockpit Control Device Design Using Mixed Reality Device",2022,"International Conference on Human …","Springer","https://link.springer.com/chapter/10.1007/978-3-031-06015-1_14","https://scholar.google.com/scholar?cites=3653979301712298107&as_sdt=2005&sciodt=0,5&hl=en",84,"2023-12-13 11:24:03","","10.1007/978-3-031-06015-1_14","","",,,,,2,2.00,1,4,1,"… Mixed Reality are considered enabling technologies for the Industry 4.0 paradigm. Mixed Reality … With the commercialization of Mixed Reality, we expect this technology to be applied in …","","https://scholar.google.com/scholar?q=related:ewAxt9CKtTIJ:scholar.google.com/&scioq=mixed+reality&hl=en&as_sdt=0,5&as_ylo=2021&as_yhi=2023"
2,"K Helin, J Karjalainen, T Kuula, P Kiernan, G Casarosa…","The Remote User Test of Mixed Reality System for AIT/AIV in the Space Domain",2021,"nil e H ja K","academia.edu","https://www.academia.edu/download/94746897/T395.pdf#page=14","https://scholar.google.com/scholar?cites=12279119776010271462&as_sdt=2005&sciodt=0,5&hl=en",86,"2023-12-13 11:24:03","PDF","","","",,,,,2,1.00,0,6,2,"This extended abstract introduces the Mixed Reality (MR) system which has been developed for assembly, integration, testing and verification (AIT/V) in the space domain. It has been …","https://www.academia.edu/download/94746897/T395.pdf#page=14","https://scholar.google.com/scholar?q=related:5vqQ82AyaKoJ:scholar.google.com/&scioq=mixed+reality&hl=en&as_sdt=0,5&as_ylo=2021&as_yhi=2023"
2,"O Pappalardo, M Pasquali, A Maltagliati…","A platform for real-3d visualization and planning of left atrial appendage occlusion through mixed reality",2021,"European Heart …","academic.oup.com","https://academic.oup.com/ehjcimaging/article-abstract/22/Supplement_1/jeaa356.247/6131245","https://scholar.google.com/scholar?cites=537361892970096317&as_sdt=2005&sciodt=0,5&hl=en",91,"2023-12-13 11:24:03","","","","",,,,,2,1.00,1,4,2,"… ; Mixed Reality (MxR) technology aims at overcoming such limitations by allowing for real-3D visualizations with holographic replicas of anatomical models while preserving a sense of …","","https://scholar.google.com/scholar?q=related:vWZQassXdQcJ:scholar.google.com/&scioq=mixed+reality&hl=en&as_sdt=0,5&as_ylo=2021&as_yhi=2023"
2,"EFE Ahmet","Taking Virtual Reality and Augmented Reality to The Next Level: Artificial Intelligence with Mixed Reality",,"Kamu Yönetimi ve Teknoloji Dergisi","dergipark.org.tr","https://dergipark.org.tr/en/pub/kaytek/issue/75646/1185712","https://scholar.google.com/scholar?cites=9483213233688936543&as_sdt=2005&sciodt=0,5&hl=en",115,"2023-12-13 11:24:03","","","","",,,,,2,0.00,2,1,,"… reality (VR) and augmented reality (AR) have caused significant excitement, but Mixed reality (… With the advent of Metaverse, the reality concepts are being redefined and highlighted by …","https://dergipark.org.tr/en/download/article-file/2694698","https://scholar.google.com/scholar?q=related:XwBQGzEkm4MJ:scholar.google.com/&scioq=mixed+reality&hl=en&as_sdt=0,5&as_ylo=2021&as_yhi=2023"
2,"B LIU, L MENG","Research Progress and Prospect of Extended Reality and Geospatial Cognition",2022,"武汉大学学报 (信息科学版)","ch.whu.edu.cn","http://ch.whu.edu.cn/en/article/doi/10.13203/j.whugis20220759?viewType=SUP","https://scholar.google.com/scholar?cites=6692289005321531347&as_sdt=2005&sciodt=0,5&hl=en",129,"2023-12-13 11:24:03","HTML","10.13203/j.whugis20220759","","",,,,,2,2.00,1,2,1,"… 扩展现实(extended reality,XR)包括增强现实(augmented reality,AR),虚拟现实(virtual reality,VR)和 混合现实(mixed reality,MR),是被广泛提及的元宇宙的核心技术之一 [1] .扩展现实不仅丰富…","http://ch.whu.edu.cn/en/article/doi/10.13203/j.whugis20220759?viewType=SUP","https://scholar.google.com/scholar?q=related:0y9xoGTJ31wJ:scholar.google.com/&scioq=mixed+reality&hl=en&as_sdt=0,5&as_ylo=2021&as_yhi=2023"
2,"NA Nasharuddin, NA Umar","A Preliminary Investigation on Learning Basic Chemistry using Virtual Reality",2021,"2021 1st Conference on Online …","ieeexplore.ieee.org","https://ieeexplore.ieee.org/abstract/document/9638812/","https://scholar.google.com/scholar?cites=112828911890322022&as_sdt=2005&sciodt=0,5&hl=en",143,"2023-12-13 11:24:03","","","","",,,,,2,1.00,1,2,2,"… based education are augmented reality, virtual reality, and mixed reality. Visualising the mechanism … This study developed an immersive mobile prototype application using virtual reality …","","https://scholar.google.com/scholar?q=related:ZtKdLUzZkAEJ:scholar.google.com/&scioq=mixed+reality&hl=en&as_sdt=0,5&as_ylo=2021&as_yhi=2023"
2,"J Simonen, T Björk, T Nikula…","Measuring world-locking accuracy in ar/mr head-mounted displays",2021,"… , and Mixed Reality (AR …","spiedigitallibrary.org","https://www.spiedigitallibrary.org/conference-proceedings-of-spie/11765/117650U/Measuring-world-locking-accuracy-in-ARMR-head-mounted-displays/10.1117/12.2584208.short","https://scholar.google.com/scholar?cites=17043793947887447814&as_sdt=2005&sciodt=0,5&hl=en",163,"2023-12-13 11:24:03","","10.1117/12.2584208.short","","",,,,,2,1.00,1,4,2,"Reliable world locking in augmented and mixed reality (AR/MR) devices is important for achieving immersion and critical for technical applications that rely on stable anchoring of virtual …","","https://scholar.google.com/scholar?q=related:Bq_IMEu4h-wJ:scholar.google.com/&scioq=mixed+reality&hl=en&as_sdt=0,5&as_ylo=2021&as_yhi=2023"
2,"D Janecký, E Kučera, O Haffner","HoloLens 2 and Virtual Reality as Methods for Managing Phobias",2022,"2022 Cybernetics & …","ieeexplore.ieee.org","https://ieeexplore.ieee.org/abstract/document/9925954/","https://scholar.google.com/scholar?cites=17016007931841851803&as_sdt=2005&sciodt=0,5&hl=en",172,"2023-12-13 11:24:03","","","","",,,,,2,2.00,1,3,1,"… Since it is no longer virtual reality but mixed reality, the fear of heights could not be depicted in a believable way, so we only deal with the fear of snakes and spiders in this app [6]. …","https://ieeexplore.ieee.org/iel7/9925599/9925916/09925954.pdf","https://scholar.google.com/scholar?q=related:m7GpMA8BJewJ:scholar.google.com/&scioq=mixed+reality&hl=en&as_sdt=0,5&as_ylo=2021&as_yhi=2023"
2,"D Kim, HI Kim, W Woo","Mutual space generation with relative translation gains in redirected walking for asymmetric remote collaboration",2022,"… on Mixed and Augmented Reality …","ieeexplore.ieee.org","https://ieeexplore.ieee.org/abstract/document/9974247/","https://scholar.google.com/scholar?cites=2304826514357353190&as_sdt=2005&sciodt=0,5&hl=en",181,"2023-12-13 11:24:03","","","","",,,,,2,2.00,1,3,1,"… This study proposed a Mixed Reality (MR) mutual space generation method that aligns the Virtual Reality (VR) clients’ spaces around the Augmented Reality (AR) host space’s …","https://ieeexplore.ieee.org/iel7/9973799/9974160/09974247.pdf","https://scholar.google.com/scholar?q=related:5vor2YBj_B8J:scholar.google.com/&scioq=mixed+reality&hl=en&as_sdt=0,5&as_ylo=2021&as_yhi=2023"
2,"D Rompapas, C Rodda, BC Brown, NB Zerkin…","Project esky: An open source software framework for high fidelity extended reality",2021,"Extended Abstracts of …","dl.acm.org","https://dl.acm.org/doi/abs/10.1145/3411763.3451804","https://scholar.google.com/scholar?cites=8418713266262641973&as_sdt=2005&sciodt=0,5&hl=en",184,"2023-12-13 11:24:03","","10.1145/3411763.3451804","","",,,,,2,1.00,0,5,2,"… Our framework also includes calibration methods to compute the between-sensor ofsets, integration with Microsoft’s Mixed Reality Toolkit for hand-gesture based interactions, and a …","https://dl.acm.org/doi/pdf/10.1145/3411763.3451804","https://scholar.google.com/scholar?q=related:NQ10hRxH1XQJ:scholar.google.com/&scioq=mixed+reality&hl=en&as_sdt=0,5&as_ylo=2021&as_yhi=2023"
2,"T Tariuge","Speech-based virtual assistant for treatment of Alzheimer disease patient using virtual reality environment (VRE)",2022,"International Conference on Human-Computer …","Springer","https://link.springer.com/chapter/10.1007/978-3-031-05014-5_31","https://scholar.google.com/scholar?cites=428975092636132595&as_sdt=2005&sciodt=0,5&hl=en",190,"2023-12-13 11:24:03","","10.1007/978-3-031-05014-5_31","","",,,,,2,2.00,2,1,1,"… Hololearn: Learning through mixed reality for people with Cognitive … The subjects were made to use Mixed Reality (MR) … In a research conducted by [4], a mixed Reality device which can …","","https://scholar.google.com/scholar?q=related:8yQR7pIG9AUJ:scholar.google.com/&scioq=mixed+reality&hl=en&as_sdt=0,5&as_ylo=2021&as_yhi=2023"
1,"LFS Cardoso, BYL Kimura, ER Zorzal","Towards augmented and mixed reality on future mobile networks",2023,"Multimedia Tools and Applications","Springer","https://link.springer.com/article/10.1007/s11042-023-15301-4","https://scholar.google.com/scholar?cites=17506626783219415160&as_sdt=2005&sciodt=0,5&hl=en",58,"2023-12-13 11:24:03","HTML","10.1007/s11042-023-15301-4","","",,,,,1,1.00,0,3,1,"Augmented and Mixed Reality (AR/MR) technologies enhance the human perception of the world by combining virtual and real environments. With the increase of mobile devices and …","https://link.springer.com/article/10.1007/s11042-023-15301-4","https://scholar.google.com/scholar?q=related:ePghJU4I9PIJ:scholar.google.com/&scioq=mixed+reality&hl=en&as_sdt=0,5&as_ylo=2021&as_yhi=2023"
1,"GD Voinea, RG Boboc…","MIXED REALITY TOOLS FOR EDUCATION IN THE METAVERSE",2022,"Education and …","end-educationconference.org","https://end-educationconference.org/wp-content/uploads/2022/07/2022v2end056.pdf","https://scholar.google.com/scholar?cites=9563102853531596077&as_sdt=2005&sciodt=0,5&hl=en",63,"2023-12-13 11:24:03","PDF","","","",,,,,1,1.00,0,3,1,"… In this article we briefly present several free tools that educators can adapt and use to create a virtual classroom based on mixed reality (XR) technologies, along with the main XR …","https://end-educationconference.org/wp-content/uploads/2022/07/2022v2end056.pdf","https://scholar.google.com/scholar?q=related:LXVGt2D3toQJ:scholar.google.com/&scioq=mixed+reality&hl=en&as_sdt=0,5&as_ylo=2021&as_yhi=2023"
1,"T Wächter, J Rexilius, M König","Interactive evacuation in intelligent buildings assisted by mixed reality",2022,"Journal of Smart Cities and …","content.iospress.com","https://content.iospress.com/articles/journal-of-smart-cities-and-society/scs220009","https://scholar.google.com/scholar?cites=11291967951934769473&as_sdt=2005&sciodt=0,5&hl=en",80,"2023-12-13 11:24:03","HTML","","","",,,,,1,1.00,0,3,1,"… Furthermore, we aimed the use upcoming mixed reality technology for our purpose. To this end, we used a HoloLens from Microsoft. The display in the glasses show the user an arrow …","https://content.iospress.com/articles/journal-of-smart-cities-and-society/scs220009","https://scholar.google.com/scholar?q=related:QckqXgYhtZwJ:scholar.google.com/&scioq=mixed+reality&hl=en&as_sdt=0,5&as_ylo=2021&as_yhi=2023"
1,"K Chaudhari","Mixed Reality in Transportation Industry",2021,"unpublished article","researchgate.net","https://www.researchgate.net/profile/Krutarth-Chaudhari/publication/357327231_MIXED_REALITY_IN_TRANSPORTATION_INDUSTRY/links/61c73768da5d105e55f84470/MIXED-REALITY-IN-TRANSPORTATION-INDUSTRY.pdf","https://scholar.google.com/scholar?cites=3036657850927615544&as_sdt=2005&sciodt=0,5&hl=en",81,"2023-12-13 11:24:03","PDF","","","",,,,,1,0.50,1,1,2,"… The current review aims to study the fundamental application of Mixed Reality (MR) technology in the field of transportation. For this review, literature was collected from various sources …","https://www.researchgate.net/profile/Krutarth-Chaudhari/publication/357327231_MIXED_REALITY_IN_TRANSPORTATION_INDUSTRY/links/61c73768da5d105e55f84470/MIXED-REALITY-IN-TRANSPORTATION-INDUSTRY.pdf","https://scholar.google.com/scholar?q=related:OA7x_DlgJCoJ:scholar.google.com/&scioq=mixed+reality&hl=en&as_sdt=0,5&as_ylo=2021&as_yhi=2023"
1,"N Yilmaz, E Ergen, D Artan","A usability test protocol for evaluating mixed reality environments",2021,"EC3 Conference 2021","ec-3.org","https://ec-3.org/publications/conference/paper/?id=EC32021_174","https://scholar.google.com/scholar?cites=9846830547244705607&as_sdt=2005&sciodt=0,5&hl=en",82,"2023-12-13 11:24:03","","","","",,,,,1,0.50,0,3,2,"… of a prototype, which is developed for a mixed reality environment in a building. The main … proposed for the evaluation of mixed reality environments in the facility management phase. …","https://ec-3.org/publications/conferences/EC32021/papers/EC32021_174.pdf","https://scholar.google.com/scholar?q=related:R2f8Qzb4pogJ:scholar.google.com/&scioq=mixed+reality&hl=en&as_sdt=0,5&as_ylo=2021&as_yhi=2023"
1,"A Kundu, YS Pai, K Minamizawa","Investigating the Relation Between Gender Expression of Mixed Reality Avatars and Sexuality of Male Users",2022,"… and Augmented Reality …","ieeexplore.ieee.org","https://ieeexplore.ieee.org/abstract/document/9974400/","https://scholar.google.com/scholar?cites=12466574233666932794&as_sdt=2005&sciodt=0,5&hl=en",88,"2023-12-13 11:24:03","","","","",,,,,1,1.00,0,3,1,"… Mixed reality environments are the next step in remote … perform a collaborative task in mixed reality. We analyzed the perception of … And for mixed reality, gay men also tend to have both …","https://ieeexplore.ieee.org/iel7/9973799/9974160/09974400.pdf","https://scholar.google.com/scholar?q=related:OlDB-zYrAq0J:scholar.google.com/&scioq=mixed+reality&hl=en&as_sdt=0,5&as_ylo=2021&as_yhi=2023"
1,"M Hedemyr","Mixed Reality in Public Space: Expanding Composition Practices in Choreography and Interaction Design",2023,"","diva-portal.org","https://www.diva-portal.org/smash/record.jsf?pid=diva2:1741147","https://scholar.google.com/scholar?cites=16324413675599714554&as_sdt=2005&sciodt=0,5&hl=en",92,"2023-12-13 11:24:03","","","","",,,,,1,1.00,1,1,1,"Although artistic augmented reality (AR) and mixed reality (MR) experiences have been discussed in multiple scholarly fields, when it comes to interaction design, comprehensive …","","https://scholar.google.com/scholar?q=related:-limXL_3i-IJ:scholar.google.com/&scioq=mixed+reality&hl=en&as_sdt=0,5&as_ylo=2021&as_yhi=2023"
1,"E Bollen, L Awad, B Langridge…","P07 The intraoperative use of augmented and mixed reality technology to improve surgical outcomes: a systematic review",2022,"British Journal of …","academic.oup.com","https://academic.oup.com/bjs/article-abstract/109/Supplement_4/znac231.007/6648592","https://scholar.google.com/scholar?cites=5041716931371056212&as_sdt=2005&sciodt=0,5&hl=en",93,"2023-12-13 11:24:03","","","","",,,,,1,1.00,0,4,1,"… Augmented reality and mixed reality technology give the user an altered perception of their surroundings. … use of augmented and mixed reality technology to improve surgical outcomes. …","","https://scholar.google.com/scholar?q=related:VLxxQNbG90UJ:scholar.google.com/&scioq=mixed+reality&hl=en&as_sdt=0,5&as_ylo=2021&as_yhi=2023"
1,"R Schubert, G Bruder, A Tanaka, F Guido-Sanz…","Mixed Reality Technology Capabilities for Combat-Casualty Handoff Training",2021,"… Conference on Human …","Springer","https://link.springer.com/chapter/10.1007/978-3-030-77599-5_47","https://scholar.google.com/scholar?cites=5528642629001630776&as_sdt=2005&sciodt=0,5&hl=en",95,"2023-12-13 11:24:03","","10.1007/978-3-030-77599-5_47","","",,,,,1,0.50,0,5,2,"… Here we discuss a variety of mixed reality capabilities and training contexts that can manipulate many of these handoff complexities in a controlled manner. We finally discuss some …","https://par.nsf.gov/servlets/purl/10343514","https://scholar.google.com/scholar?q=related:OFS51y2vuUwJ:scholar.google.com/&scioq=mixed+reality&hl=en&as_sdt=0,5&as_ylo=2021&as_yhi=2023"
1,"E Gonzalez-Sosa, G Robledo…","Real Time Egocentric Object Segmentation for Mixed Reality: THU-READ Labeling and Benchmarking Results",2022,"… Reality and 3D User …","ieeexplore.ieee.org","https://ieeexplore.ieee.org/abstract/document/9757563/","https://scholar.google.com/scholar?cites=2654884332196276883&as_sdt=2005&sciodt=0,5&hl=en",96,"2023-12-13 11:24:03","","","","",,,,,1,1.00,0,3,1,"Egocentric segmentation has attracted recent interest in the computer vision community due to their potential in Mixed Reality (MR) applications. While most previous works have been …","","https://scholar.google.com/scholar?q=related:kypP5DsL2CQJ:scholar.google.com/&scioq=mixed+reality&hl=en&as_sdt=0,5&as_ylo=2021&as_yhi=2023"
1,"S Teruggi, F Fassi","Machines Learning for Mixed Reality: The Milan Cathedral from Survey to Holograms",2021,"… ICPR International Workshops and Challenges: Virtual …","Springer","https://link.springer.com/chapter/10.1007/978-3-030-68796-0_44","https://scholar.google.com/scholar?cites=17708528769392927081&as_sdt=2005&sciodt=0,5&hl=en",97,"2023-12-13 11:24:03","","10.1007/978-3-030-68796-0_44","","",,,,,1,0.50,1,2,2,"… The 3D point model, so structured, for the first time, is used directly in a Mixed Reality (MR) environment to develop an application that could benefit professional works, allowing to use …","","https://scholar.google.com/scholar?q=related:aWFzihdVwfUJ:scholar.google.com/&scioq=mixed+reality&hl=en&as_sdt=0,5&as_ylo=2021&as_yhi=2023"
1,"SY Teng, P Li, R Nith, J Fonseca, P Lopes","Demonstrating Touch&Fold: A Foldable Haptic Actuator for Rendering Touch in Mixed Reality",2021,"Extended Abstracts of the …","dl.acm.org","https://dl.acm.org/doi/abs/10.1145/3411763.3451540","https://scholar.google.com/scholar?cites=3726440892640709361&as_sdt=2005&sciodt=0,5&hl=en",100,"2023-12-13 11:24:03","","10.1145/3411763.3451540","","",,,,,1,0.50,0,5,2,"… We propose a nail-mounted foldable haptic device that provides tactile feedback to mixed reality (MR) environments by pressing against the user’s fngerpad when a user touches a …","https://dl.acm.org/doi/pdf/10.1145/3411763.3451540","https://scholar.google.com/scholar?q=related:8cpWkj_6tjMJ:scholar.google.com/&scioq=mixed+reality&hl=en&as_sdt=0,5&as_ylo=2021&as_yhi=2023"
1,"S Addy","History re-experienced: Implementing mixed reality systems into historic house museums",2021,"International Journal of Machine Learning and …","ijmlc.org","http://www.ijmlc.org/vol11/1053-CA0006.pdf","https://scholar.google.com/scholar?cites=13054325792539153569&as_sdt=2005&sciodt=0,5&hl=en",103,"2023-12-13 11:24:03","PDF","","","",,,,,1,0.50,1,1,2,"… mixed reality displays [12]. The authors identified six classes of mixed reality display environments used as metrics for distinguishing the various subsets of mixed reality experiences. …","http://www.ijmlc.org/vol11/1053-CA0006.pdf","https://scholar.google.com/scholar?q=related:oRSEviRIKrUJ:scholar.google.com/&scioq=mixed+reality&hl=en&as_sdt=0,5&as_ylo=2021&as_yhi=2023"
1,"A Maharjan, A Alsadoon, PWC Prasad…","A novel solution of using mixed reality in bowel and oral and maxillofacial surgical telepresence: 3D mean value cloning algorithm",2021,"… Journal of Medical …","Wiley Online Library","https://onlinelibrary.wiley.com/doi/abs/10.1002/rcs.2224","https://scholar.google.com/scholar?cites=2664169762869264056&as_sdt=2005&sciodt=0,5&hl=en",105,"2023-12-13 11:24:03","","10.1002/rcs.2224","","",,,,,1,0.50,0,4,2,"… The main purpose of this literature review is to gain in-depth knowledge about the surgical telepresence, mixed reality, augmented reality and virtual reality. It provides the information …","https://onlinelibrary.wiley.com/doi/pdf/10.1002/rcs.2224","https://scholar.google.com/scholar?q=related:uL4osUgI-SQJ:scholar.google.com/&scioq=mixed+reality&hl=en&as_sdt=0,5&as_ylo=2021&as_yhi=2023"
1,"S Sakaguchi, M Makino","A mixed reality-based fire evacuation drill system",2021,"International Workshop on …","spiedigitallibrary.org","https://www.spiedigitallibrary.org/conference-proceedings-of-spie/11766/1176620/A-mixed-reality-based-fire-evacuation-drill-system/10.1117/12.2591015.short","https://scholar.google.com/scholar?cites=16164717524886876331&as_sdt=2005&sciodt=0,5&hl=en",107,"2023-12-13 11:24:03","","10.1117/12.2591015.short","","",,,,,1,0.50,1,2,2,"… limited, it is difficult to conduct drills with such realities in schools and workplaces. In this paper, we propose a system that uses mixed reality (MR) technology to simulate fire and smoke …","","https://scholar.google.com/scholar?q=related:q_BpzfGcVOAJ:scholar.google.com/&scioq=mixed+reality&hl=en&as_sdt=0,5&as_ylo=2021&as_yhi=2023"
1,"G Coulson, S Jowsey, M Williams, G Olivares","O-Tū-Kapua (What Clouds See): A Mixed Reality Exploration of Atmospheric Science",2021,"Leonardo","direct.mit.edu","https://direct.mit.edu/leon/article-abstract/54/2/215/97215","https://scholar.google.com/scholar?cites=375090846025486183&as_sdt=2005&sciodt=0,5&hl=en",109,"2023-12-13 11:24:03","","","","",,,,,1,0.50,0,4,2,"The authors’ project O-Tū-Kapua (what clouds see) explored concepts related to air quality by creating a mixed reality, art/science, educationally focused exhibition for children, mixing …","https://search.ebscohost.com/login.aspx?direct=true&profile=ehost&scope=site&authtype=crawler&jrnl=0024094X&AN=152125497&h=D48y7eONvYQIgKXRpvHoXk1vZi%2FMzPmhIFYSwlFbUd%2BEZowqjVd%2FaXdvfl8zLXq%2F7madceQWKqc5JNR1TTgBRw%3D%3D&crl=f","https://scholar.google.com/scholar?q=related:Z4_ZGyOXNAUJ:scholar.google.com/&scioq=mixed+reality&hl=en&as_sdt=0,5&as_ylo=2021&as_yhi=2023"
1,"JA Sánchez-Margallo…","Mixed Reality Application for Surgical Planning in Video-Assisted Pulmonary Lobectomy",2021,"British Journal of …","academic.oup.com","https://academic.oup.com/bjs/article-abstract/108/Supplement_3/znab160.058/6276341","https://scholar.google.com/scholar?cites=17648441520000712623&as_sdt=2005&sciodt=0,5&hl=en",116,"2023-12-13 11:24:03","","","","",,,,,1,0.50,1,2,2,"… A new application for surgical planning in video-assisted thoracoscopic surgery was developed, making use of the HoloLens (v1) mixed reality device. The information was displayed in …","","https://scholar.google.com/scholar?q=related:r7_llg7c6_QJ:scholar.google.com/&scioq=mixed+reality&hl=en&as_sdt=0,5&as_ylo=2021&as_yhi=2023"
1,"N XIN, X DING, K HUANG, R WEI…","Application of mixed reality technique in medicine",2021,"Chinese Journal of …","pesquisa.bvsalud.org","https://pesquisa.bvsalud.org/portal/resource/pt/wpr-881227","https://scholar.google.com/scholar?cites=10954335808796803676&as_sdt=2005&sciodt=0,5&hl=en",120,"2023-12-13 11:24:03","","","","",,,,,1,0.50,0,5,2,"… of the combination of mixed reality and medicine is boundless. It is believed that mixed reality will bring … In this paper, the application of mixed reality in medicine was summarized. …","","https://scholar.google.com/scholar?q=related:XMKsKWGeBZgJ:scholar.google.com/&scioq=mixed+reality&hl=en&as_sdt=0,5&as_ylo=2021&as_yhi=2023"
1,"I Derda, T Feustel, Z Popoli","(In-) Between Spaces: Challenges in Defining the Experience of Space in Mixed Reality Art Exhibitions",2021,"The International Journal of Creative …","University of Bath","","https://scholar.google.com/scholar?cites=10101244884839762923&as_sdt=2005&sciodt=0,5&hl=en",128,"2023-12-13 11:24:03","CITATION","","","",,,,,1,0.50,0,3,2,"","","https://scholar.google.com/scholar?q=related:6wsbPrTULowJ:scholar.google.com/&scioq=mixed+reality&hl=en&as_sdt=0,5&as_ylo=2021&as_yhi=2023"
1,"A Malaweera, R Jogi, M Wright, M O'Neill…","A mixed-reality holographic viewing platform enabling interaction with 3D electroanatomical maps using the HoloLens",2021,"European Heart …","academic.oup.com","https://academic.oup.com/eurheartj/article-abstract/42/Supplement_1/ehab724.0371/6393756","https://scholar.google.com/scholar?cites=13601150894643997099&as_sdt=2005&sciodt=0,5&hl=en",134,"2023-12-13 11:24:03","","","","",,,,,1,0.50,0,5,2,"mixed-reality holographic viewing platform enabling interaction with 3D electroanatomical … To overcome these, we created a novel technology to display EAMs on a mixed reality (MR) …","","https://scholar.google.com/scholar?q=related:q-m9O63-wLwJ:scholar.google.com/&scioq=mixed+reality&hl=en&as_sdt=0,5&as_ylo=2021&as_yhi=2023"
