Cites,Authors,Title,Year,Source,Publisher,ArticleURL,CitesURL,GSRank,QueryDate,Type,DOI,ISSN,CitationURL,Volume,Issue,StartPage,EndPage,ECC,CitesPerYear,CitesPerAuthor,AuthorCount,Age,Abstract,FullTextURL,RelatedURL
1075,"C Flavián, S Ibáñez-Sánchez, C Orús","The impact of virtual, augmented and mixed reality technologies on the customer experience",2019,"Journal of business research","Elsevier","https://www.sciencedirect.com/science/article/pii/S0148296318305319","https://scholar.google.com/scholar?cites=17568932679257549510&as_sdt=2005&sciodt=0,5&hl=en",36,"2023-12-13 12:37:33","HTML","","","",,,,,1075,268.75,358,3,4,"The arrival of Virtual-Reality, Augmented-Reality, and Mixed-Reality technologies is shaping a new environment where physical and virtual objects are integrated at different levels. Due …","https://www.sciencedirect.com/science/article/pii/S0148296318305319","https://scholar.google.com/scholar?q=related:xurlBTBj0fMJ:scholar.google.com/&scioq=intitle:mixed+intitle:reality&hl=en&as_sdt=0,5&as_ylo=2003&as_yhi=2023"
862,"Z Pan, AD Cheok, H Yang, J Zhu, J Shi","Virtual reality and mixed reality for virtual learning environments",2006,"Computers &graphics","Elsevier","https://www.sciencedirect.com/science/article/pii/S0097849305002025","https://scholar.google.com/scholar?cites=12270356323571182302&as_sdt=2005&sciodt=0,5&hl=en",8,"2023-12-13 12:37:33","HTML","","","",,,,,862,50.71,172,5,17,"… Mixed reality (MR) refers to the incorporation of virtual … reality, and the latter as augmented virtuality. Azuma [1] has defined three characteristics that are integral to an augmented reality …","https://www.sciencedirect.com/science/article/pii/S0097849305002025","https://scholar.google.com/scholar?q=related:3qrtrRAQSaoJ:scholar.google.com/&scioq=intitle:mixed+intitle:reality&hl=en&as_sdt=0,5&as_ylo=2003&as_yhi=2023"
731,"MK Bekele, R Pierdicca, E Frontoni…","A survey of augmented, virtual, and mixed reality for cultural heritage",2018,"Journal on Computing …","dl.acm.org","https://dl.acm.org/doi/abs/10.1145/3145534","https://scholar.google.com/scholar?cites=776346905779482982&as_sdt=2005&sciodt=0,5&hl=en",23,"2023-12-13 12:37:33","","10.1145/3145534","","",,,,,731,146.20,183,4,5,"… Mixed reality is an environment where real and virtual content coexist and interact in real time. The aspects of augmented and virtual reality … aspects of a mixed reality experience. It is …","https://dl.acm.org/doi/pdf/10.1145/3145534","https://scholar.google.com/scholar?q=related:ZrF1xWUjxgoJ:scholar.google.com/&scioq=intitle:mixed+intitle:reality&hl=en&as_sdt=0,5&as_ylo=2003&as_yhi=2023"
625,"R Lindgren, M Johnson-Glenberg","Emboldened by embodiment: Six precepts for research on embodied learning and mixed reality",2013,"Educational researcher","journals.sagepub.com","https://journals.sagepub.com/doi/abs/10.3102/0013189X13511661","https://scholar.google.com/scholar?cites=13600447383783500746&as_sdt=2005&sciodt=0,5&hl=en",178,"2023-12-13 12:37:33","","10.3102/0013189X13511661","","",,,,,625,62.50,313,2,10,"The authors describe an emerging paradigm of educational research that pairs theories of embodied learning with a class of immersive technologies referred to as mixed reality (MR). …","https://journals.sagepub.com/doi/full/10.3102/0013189X13511661","https://scholar.google.com/scholar?q=related:ymvOWNZ-vrwJ:scholar.google.com/&scioq=intitle:mixed+intitle:reality&hl=en&as_sdt=0,5&as_ylo=2003&as_yhi=2023"
557,"R Lindgren, M Tscholl, S Wang, E Johnson","Enhancing learning and engagement through embodied interaction within a mixed reality simulation",2016,"Computers &Education","Elsevier","https://www.sciencedirect.com/science/article/pii/S036013151630001X","https://scholar.google.com/scholar?cites=3031115553068229164&as_sdt=2005&sciodt=0,5&hl=en",82,"2023-12-13 12:37:33","HTML","","","",,,,,557,79.57,139,4,7,"… This study investigates the effects of a whole-body, mixed reality simulation game on science learning outcomes by comparing participant performance in the experimental simulation to …","https://www.sciencedirect.com/science/article/pii/S036013151630001X","https://scholar.google.com/scholar?q=related:LCLLNYmvECoJ:scholar.google.com/&scioq=intitle:mixed+intitle:reality&hl=en&as_sdt=0,5&as_ylo=2003&as_yhi=2023"
499,"M Speicher, BD Hall, M Nebeling","What is mixed reality?",2019,"… of the 2019 CHI conference on …","dl.acm.org","https://dl.acm.org/doi/abs/10.1145/3290605.3300767","https://scholar.google.com/scholar?cites=17843482105880009741&as_sdt=2005&sciodt=0,5&hl=en",1,"2023-12-13 12:37:33","","10.1145/3290605.3300767","","",,,,,499,124.75,166,3,4,"… To get a better understanding of accepted notions of Mixed Reality and in which ways they potentially differ—and therefore as a foundation for our conceptual framework of Mixed Reality…","https://dl.acm.org/doi/pdf/10.1145/3290605.3300767","https://scholar.google.com/scholar?q=related:DVwEvW_IoPcJ:scholar.google.com/&scioq=intitle:mixed+intitle:reality&hl=en&as_sdt=0,5&as_ylo=2003&as_yhi=2023"
456,"S Benford, G Giannachi","Performing mixed reality",2011,"","books.google.com","https://books.google.com/books?hl=en&lr=&id=AvsMEAAAQBAJ&oi=fnd&pg=PR9&dq=mixed+reality&ots=JNhHR81e2E&sig=aUp5Ux-m7pI9-oJe3MdmCQcaubs","https://scholar.google.com/scholar?cites=16559597259365852826&as_sdt=2005&sciodt=0,5&hl=en",3,"2023-12-13 12:37:33","BOOK","","","",,,,,456,38.00,228,2,12,"… the general background to our study of mixed reality performance, covering ⚫ the definition of mixed reality performance in relation to the wider fields of mixed reality and performance; …","","https://scholar.google.com/scholar?q=related:mqYIjPiBz-UJ:scholar.google.com/&scioq=intitle:mixed+intitle:reality&hl=en&as_sdt=0,5&as_ylo=2003&as_yhi=2023"
455,"CE Hughes, CB Stapleton, DE Hughes…","Mixed reality in education, entertainment, and training",2005,"IEEE computer …","ieeexplore.ieee.org","https://ieeexplore.ieee.org/abstract/document/1528429/","https://scholar.google.com/scholar?cites=9268089809918211254&as_sdt=2005&sciodt=0,5&hl=en",6,"2023-12-13 12:37:33","","","","",,,,,455,25.28,114,4,18,"… To transform technical capabilities of emerging mixed reality (MR) technology into the mainstream involves the integration and evolution of unproven systems. For example, real-world …","https://ieeexplore.ieee.org/iel5/38/32639/01528429.pdf","https://scholar.google.com/scholar?q=related:trSX4pPenoAJ:scholar.google.com/&scioq=intitle:mixed+intitle:reality&hl=en&as_sdt=0,5&as_ylo=2003&as_yhi=2023"
393,"SE Kirkley, JR Kirkley","Creating next generation blended learning environments using mixed reality, video games and simulations",2005,"TechTrends","Springer","https://link.springer.com/article/10.1007/BF02763646","https://scholar.google.com/scholar?cites=5424241262609412285&as_sdt=2005&sciodt=0,5&hl=en",116,"2023-12-13 12:37:33","","10.1007/BF02763646","","",,,,,393,21.83,197,2,18,"The goal of this article has been to discuss next generation learning environments and next generation training technologies as well as the learning and design challenges faced in …","https://link.springer.com/content/pdf/10.1007/BF02763646.pdf","https://scholar.google.com/scholar?q=related:vbDZgbDGRksJ:scholar.google.com/&scioq=intitle:mixed+intitle:reality&hl=en&as_sdt=0,5&as_ylo=2003&as_yhi=2023"
351,"AD Kaplan, J Cruit, M Endsley, SM Beers…","The effects of virtual reality, augmented reality, and mixed reality as training enhancement methods: A meta-analysis",2021,"Human …","journals.sagepub.com","https://journals.sagepub.com/doi/abs/10.1177/0018720820904229","https://scholar.google.com/scholar?cites=2909967732783144567&as_sdt=2005&sciodt=0,5&hl=en",14,"2023-12-13 12:37:33","","10.1177/0018720820904229","","",,,,,351,175.50,70,5,2,"… flat panel displays, we are witnessing an increasing use of augmented reality (AR) and virtual reality (VR) displays, and new mixed reality (MR) displays, which include both AR and VR. …","https://journals.sagepub.com/doi/full/10.1177/0018720820904229","https://scholar.google.com/scholar?q=related:d15jPDxIYigJ:scholar.google.com/&scioq=intitle:mixed+intitle:reality&hl=en&as_sdt=0,5&as_ylo=2003&as_yhi=2023"
346,"M Farshid, J Paschen, T Eriksson, J Kietzmann","Go boldly!: Explore augmented reality (AR), virtual reality (VR), and mixed reality (MR) for business",2018,"Business horizons","Elsevier","https://www.sciencedirect.com/science/article/pii/S000768131830079X","https://scholar.google.com/scholar?cites=18340870695841320865&as_sdt=2005&sciodt=0,5&hl=en",17,"2023-12-13 12:37:33","HTML","","","",,,,,346,69.20,87,4,5,"… , virtual reality is actually just one type of reality—the beginning of the virtual reality continuum—which also includes mixed reality, … Each type of reality on the virtual reality continuum …","https://www.sciencedirect.com/science/article/pii/S000768131830079X","https://scholar.google.com/scholar?q=related:oU_-SLnch_4J:scholar.google.com/&scioq=intitle:mixed+intitle:reality&hl=en&as_sdt=0,5&as_ylo=2003&as_yhi=2023"
346,"MC Johnson-Glenberg, DA Birchfield…","Collaborative embodied learning in mixed reality motion-capture environments: Two science studies.",2014,"Journal of …","psycnet.apa.org","https://psycnet.apa.org/record/2013-32701-001","https://scholar.google.com/scholar?cites=17092402922140623363&as_sdt=2005&sciodt=0,5&hl=en",155,"2023-12-13 12:37:33","","","","",,,,,346,38.44,115,3,9,"… to which an Embodied Mixed Reality Learning Environment (EMRELE) can enhance science learning compared to regular classroom instruction. Mixed reality means that physical …","https://www.embodied-games.com/wp-new/wp-content/uploads/2018/03/JEP_SMALLAB_-Published.pdf","https://scholar.google.com/scholar?q=related:A2IK9OVpNO0J:scholar.google.com/&scioq=intitle:mixed+intitle:reality&hl=en&as_sdt=0,5&as_ylo=2003&as_yhi=2023"
341,"M Flintham, S Benford, R Anastasi…","Where on-line meets on the streets: experiences with mobile mixed reality games",2003,"Proceedings of the …","dl.acm.org","https://dl.acm.org/doi/abs/10.1145/642611.642710","https://scholar.google.com/scholar?cites=17464597243984498737&as_sdt=2005&sciodt=0,5&hl=en",48,"2023-12-13 12:37:33","","10.1145/642611.642710","","",,,,,341,17.05,85,4,20,"… reality games. The latter include the use of handheld computers and augmented reality … In this paper, we compare two early experiences of mobile mixed reality games. In the first, …","https://dl.acm.org/doi/pdf/10.1145/642611.642710","https://scholar.google.com/scholar?q=related:MVD2eKm2XvIJ:scholar.google.com/&scioq=intitle:mixed+intitle:reality&hl=en&as_sdt=0,5&as_ylo=2003&as_yhi=2023"
322,"WA IJsselsteijn, YAW de Kort, A Haans","Is This My Hand I See Before Me? The Rubber Hand Illusion in Reality, Virtual Reality, and Mixed Reality",2006,"Presence: Teleoperators and …","direct.mit.edu","https://direct.mit.edu/pvar/article-abstract/15/4/455/18620","https://scholar.google.com/scholar?cites=1206663457835970136&as_sdt=2005&sciodt=0,5&hl=en",31,"2023-12-13 12:37:33","","","","",,,,,322,18.94,107,3,17,"This paper presents a first study in which a recently reported intermodal perceptual illusion known as the rubber hand illusion is experimentally investigated under mediated conditions. …","https://www.academia.edu/download/39634583/IJsselsteijn__de_Kort___Haans_-_2006_-_Is_This_My_Hand_I_See_Before_Me_The_Rubber_Hand_Illusion_in_Reality__Virtual_Reality__and_Mixed_R.pdf","https://scholar.google.com/scholar?q=related:WO7BjwXuvhAJ:scholar.google.com/&scioq=intitle:mixed+intitle:reality&hl=en&as_sdt=0,5&as_ylo=2003&as_yhi=2023"
322,"T Piumsomboon, GA Lee, JD Hart, B Ens…","Mini-me: An adaptive avatar for mixed reality remote collaboration",2018,"Proceedings of the …","dl.acm.org","https://dl.acm.org/doi/abs/10.1145/3173574.3173620","https://scholar.google.com/scholar?cites=17896954199314207368&as_sdt=2005&sciodt=0,5&hl=en",156,"2023-12-13 12:37:33","","10.1145/3173574.3173620","","",,,,,322,64.40,64,5,5,"… This paper explores how adaptive avatars can improve Mixed Reality (MR) remote … users in the real world using Augmented Reality (AR) and remote users in Virtual Reality (VR) may be …","https://dl.acm.org/doi/pdf/10.1145/3173574.3173620","https://scholar.google.com/scholar?q=related:iBKPqwXBXvgJ:scholar.google.com/&scioq=intitle:mixed+intitle:reality&hl=en&as_sdt=0,5&as_ylo=2003&as_yhi=2023"
305,"OM Tepper, HL Rudy, A Lefkowitz…","Mixed reality with HoloLens: where virtual reality meets augmented reality in the operating room",2017,"Plastic and …","ingentaconnect.com","https://www.ingentaconnect.com/content/wk/prs/2017/00000140/00000005/art00063","https://scholar.google.com/scholar?cites=9546091736385789641&as_sdt=2005&sciodt=0,5&hl=en",35,"2023-12-13 12:37:33","","","","",,,,,305,50.83,76,4,6,"… reality and/or augmented reality … as mixed reality, which merges many virtual reality and augmented realty features. Microsoft’s HoloLens, the first commercially available mixed reality …","","https://scholar.google.com/scholar?q=related:yR6RXNuHeoQJ:scholar.google.com/&scioq=intitle:mixed+intitle:reality&hl=en&as_sdt=0,5&as_ylo=2003&as_yhi=2023"
265,"MJ Maas, JM Hughes","Virtual, augmented and mixed reality in K–12 education: A review of the literature",2020,"Technology, Pedagogy and Education","Taylor &Francis","https://www.tandfonline.com/doi/abs/10.1080/1475939X.2020.1737210","https://scholar.google.com/scholar?cites=387111364175113093&as_sdt=2005&sciodt=0,5&hl=en",27,"2023-12-13 12:37:33","","10.1080/1475939X.2020.1737210","","",,,,,265,88.33,133,2,3,"… into the use of virtual, augmented and mixed reality technologies within K–12 educational … the use of virtual reality (VR), augmented reality (AR) or mixed reality (MR) technologies in the …","","https://scholar.google.com/scholar?q=related:hassFrxLXwUJ:scholar.google.com/&scioq=intitle:mixed+intitle:reality&hl=en&as_sdt=0,5&as_ylo=2003&as_yhi=2023"
259,"B Brown, I MacColl, M Chalmers, A Galani…","Lessons from the lighthouse: collaboration in a shared mixed reality system",2003,"Proceedings of the …","dl.acm.org","https://dl.acm.org/doi/abs/10.1145/642611.642711","https://scholar.google.com/scholar?cites=10728988861645880066&as_sdt=2005&sciodt=0,5&hl=en",21,"2023-12-13 12:37:33","","10.1145/642611.642711","","",,,,,259,12.95,52,5,20,"… This paper presents a study of a mixed reality system that allows web, virtual reality and physical visitors to share a museum visit together in real time. Our system allows visitors to share …","https://dl.acm.org/doi/pdf/10.1145/642611.642711","https://scholar.google.com/scholar?q=related:AnuGaYYG5ZQJ:scholar.google.com/&scioq=intitle:mixed+intitle:reality&hl=en&as_sdt=0,5&as_ylo=2003&as_yhi=2023"
248,"H Benko, EW Ishak, S Feiner","Collaborative mixed reality visualization of an archaeological excavation",2004,"… Mixed and Augmented Reality","ieeexplore.ieee.org","https://ieeexplore.ieee.org/abstract/document/1383050/","https://scholar.google.com/scholar?cites=3766017766053855115&as_sdt=2005&sciodt=0,5&hl=en",40,"2023-12-13 12:37:33","","","","",,,,,248,13.05,83,3,19,"… experimental collaborative mixed reality system for offsite visualization of an archaeological dig. Our system allows multiple users to visualize the dig site in a mixed reality environment …","https://ieeexplore.ieee.org/iel5/9498/30137/01383050.pdf","https://scholar.google.com/scholar?q=related:iz9zezSVQzQJ:scholar.google.com/&scioq=intitle:mixed+intitle:reality&hl=en&as_sdt=0,5&as_ylo=2003&as_yhi=2023"
229,"CW Chang, JH Lee, CY Wang, GD Chen","Improving the authentic learning experience by integrating robots into the mixed-reality environment",2010,"Computers &Education","Elsevier","https://www.sciencedirect.com/science/article/pii/S0360131510001831","https://scholar.google.com/scholar?cites=14897638981529191611&as_sdt=2005&sciodt=0,5&hl=en",70,"2023-12-13 12:37:33","HTML","","","",,,,,229,17.62,57,4,13,"… We designed a system, RoboStage, with authentic scenes by using mixed-reality technology and robot to investigate the difference in learning with either physical or virtual characters …","https://www.sciencedirect.com/science/article/pii/S0360131510001831","https://scholar.google.com/scholar?q=related:u0QP_rgLv84J:scholar.google.com/&scioq=intitle:mixed+intitle:reality&hl=en&as_sdt=0,5&as_ylo=2003&as_yhi=2023"
224,"J Zauner, M Haller, A Brandl…","Authoring of a mixed reality assembly instructor for hierarchical structures",2003,"… and Augmented Reality …","ieeexplore.ieee.org","https://ieeexplore.ieee.org/abstract/document/1240707/","https://scholar.google.com/scholar?cites=1773657174496242&as_sdt=2005&sciodt=0,5&hl=en",96,"2023-12-13 12:37:33","","","","",,,,,224,11.20,56,4,20,"… Our approach, likewise, uses Mixed Reality technology to solve … Mixed Reality allows a smooth combination of the real and the … of the Mixed Reality Assembly Instructor. Haringer et. al. …","https://ieeexplore.ieee.org/iel5/8784/27815/01240707.pdf","https://scholar.google.com/scholar?q=related:8tPWvSFNBgAJ:scholar.google.com/&scioq=intitle:mixed+intitle:reality&hl=en&as_sdt=0,5&as_ylo=2003&as_yhi=2023"
222,"CMY Rasimah, A Ahmad, HB Zaman","Evaluation of user acceptance of mixed reality technology",2011,"Australasian Journal of …","ajet.org.au","https://ajet.org.au/index.php/AJET/article/view/899","https://scholar.google.com/scholar?cites=4779447299694096620&as_sdt=2005&sciodt=0,5&hl=en",19,"2023-12-13 12:37:33","","","","",,,,,222,18.50,74,3,12,"… ’ perception and acceptance of mixed reality (MR) technology. … mixed reality prototype, named Mixed Reality Regenerative Concept (MRRC). MRRC was developed using mixed reality …","https://ajet.org.au/index.php/AJET/article/download/899/176/","https://scholar.google.com/scholar?q=related:7HD3GP8BVEIJ:scholar.google.com/&scioq=intitle:mixed+intitle:reality&hl=en&as_sdt=0,5&as_ylo=2003&as_yhi=2023"
219,"S Rokhsaritalemi, A Sadeghi-Niaraki, SM Choi","A review on mixed reality: Current trends, challenges and prospects",2020,"Applied Sciences","mdpi.com","https://www.mdpi.com/2076-3417/10/2/636","https://scholar.google.com/scholar?cites=5728699840861433876&as_sdt=2005&sciodt=0,5&hl=en",2,"2023-12-13 12:37:33","","","","",,,,,219,73.00,73,3,3,"… databases using the keyword “mixed reality” in the title, keywords, … that MR is everything between augmented reality (AR) and … Mixed Reality is a class of simulators that combines both …","https://www.mdpi.com/2076-3417/10/2/636/pdf","https://scholar.google.com/scholar?q=related:FPBhPydugE8J:scholar.google.com/&scioq=intitle:mixed+intitle:reality&hl=en&as_sdt=0,5&as_ylo=2003&as_yhi=2023"
211,"B Ens, J Lanir, A Tang, S Bateman, G Lee…","Revisiting collaboration through mixed reality: The evolution of groupware",2019,"International Journal of …","Elsevier","https://www.sciencedirect.com/science/article/pii/S1071581919300606","https://scholar.google.com/scholar?cites=13413193637114488975&as_sdt=2005&sciodt=0,5&hl=en",55,"2023-12-13 12:37:33","HTML","","","",,,,,211,52.75,35,6,4,"Collaborative Mixed Reality (MR) systems are at a critical point in time as they are soon to become more commonplace. However, MR technology has only recently matured to the point …","https://www.sciencedirect.com/science/article/pii/S1071581919300606","https://scholar.google.com/scholar?q=related:jyi9-4s8JboJ:scholar.google.com/&scioq=intitle:mixed+intitle:reality&hl=en&as_sdt=0,5&as_ylo=2003&as_yhi=2023"
208,"C Weichel, M Lau, D Kim, N Villar…","MixFab: a mixed-reality environment for personal fabrication",2014,"Proceedings of the …","dl.acm.org","https://dl.acm.org/doi/abs/10.1145/2556288.2557090","https://scholar.google.com/scholar?cites=2954052484347483032&as_sdt=2005&sciodt=0,5&hl=en",10,"2023-12-13 12:37:33","","10.1145/2556288.2557090","","",,,,,208,23.11,42,5,9,"… First we propose and implement an immersive mixed-reality environment by combining an augmented reality setup, gesture recognition and 3D scanning capabilities. Our second …","https://dl.acm.org/doi/pdf/10.1145/2556288.2557090","https://scholar.google.com/scholar?q=related:mFNkURXn_igJ:scholar.google.com/&scioq=intitle:mixed+intitle:reality&hl=en&as_sdt=0,5&as_ylo=2003&as_yhi=2023"
201,"W Hoenig, C Milanes, L Scaria, T Phan…","Mixed reality for robotics",2015,"2015 IEEE/RSJ …","ieeexplore.ieee.org","https://ieeexplore.ieee.org/abstract/document/7354138/","https://scholar.google.com/scholar?cites=298595025936926381&as_sdt=2005&sciodt=0,5&hl=en",7,"2023-12-13 12:37:33","","","","",,,,,201,25.13,40,5,8,"… show that Mixed Reality can … Mixed Reality with three representative experiments, each of which highlights the advantages of our approach. We also provide a testbed for Mixed Reality …","https://www.researchgate.net/profile/Wolfgang-Hoenig/publication/308847201_Mixed_reality_for_robotics/links/619f88d9f8565a76fdf46d04/Mixed-reality-for-robotics.pdf","https://scholar.google.com/scholar?q=related:rUarFJjSJAQJ:scholar.google.com/&scioq=intitle:mixed+intitle:reality&hl=en&as_sdt=0,5&as_ylo=2003&as_yhi=2023"
200,"L Dieker, M Hynes, C Hughes…","Implications of mixed reality and simulation technologies on special education and teacher preparation",2008,"Focus on Exceptional …","stars.library.ucf.edu","https://stars.library.ucf.edu/cgi/viewcontent.cgi?article=1273&context=facultybib2000","https://scholar.google.com/scholar?cites=12412753887386678250&as_sdt=2005&sciodt=0,5&hl=en",121,"2023-12-13 12:37:33","PDF","","","",,,,,200,13.33,50,4,15,"… In this preliminary study we created a Mixed Reality (MR) speech experience to test whether this medium delivers the realism necessary to create heightened anxiety and consequent …","https://stars.library.ucf.edu/cgi/viewcontent.cgi?article=1273&context=facultybib2000","https://scholar.google.com/scholar?q=related:6jMIHuX1QqwJ:scholar.google.com/&scioq=intitle:mixed+intitle:reality&hl=en&as_sdt=0,5&as_ylo=2003&as_yhi=2023"
197,"KJL Nevelsteen","Virtual world, defined from a technological perspective and applied to video games, mixed reality, and the Metaverse",2018,"Computer animation and virtual worlds","Wiley Online Library","https://onlinelibrary.wiley.com/doi/abs/10.1002/cav.1752","https://scholar.google.com/scholar?cites=3048041713397760767&as_sdt=2005&sciodt=0,5&hl=en",184,"2023-12-13 12:37:33","","10.1002/cav.1752","","",,,,,197,39.40,197,1,5,"… the world would be mixed reality (see Mixed Reality below). … according to ST(ie, mixed reality). Because SA is not … as a mixed reality technology, that is, with mixed reality interaction (not …","https://onlinelibrary.wiley.com/doi/pdf/10.1002/cav.1752","https://scholar.google.com/scholar?q=related:_4KlA8rRTCoJ:scholar.google.com/&scioq=intitle:mixed+intitle:reality&hl=en&as_sdt=0,5&as_ylo=2003&as_yhi=2023"
196,"BC Kress, WJ Cummings","11‐1: Invited Paper: Towards the Ultimate Mixed Reality Experience: HoloLens Display Architecture Choices",2017,"SID symposium digest of technical …","Wiley Online Library","https://sid.onlinelibrary.wiley.com/doi/abs/10.1002/sdtp.11586","https://scholar.google.com/scholar?cites=11066852029422449245&as_sdt=2005&sciodt=0,5&hl=en",81,"2023-12-13 12:37:33","","10.1002/sdtp.11586","","",,,,,196,32.67,98,2,6,"… This helps to set up the expectations for Mixed Reality (MR) headsets when compared to … 1.f) Mixed Reality (MR) HMDs: Mixed Reality HMDs are a notable evolution from standard AR …","https://sid.onlinelibrary.wiley.com/doi/pdfdirect/10.1002/sdtp.11586","https://scholar.google.com/scholar?q=related:XTKJO0lblZkJ:scholar.google.com/&scioq=intitle:mixed+intitle:reality&hl=en&as_sdt=0,5&as_ylo=2003&as_yhi=2023"
183,"F Ke, S Lee, X Xu","Teaching training in a mixed-reality integrated learning environment",2016,"Computers in Human Behavior","Elsevier","https://www.sciencedirect.com/science/article/pii/S0747563216302655","https://scholar.google.com/scholar?cites=14785977095632415053&as_sdt=2005&sciodt=0,5&hl=en",73,"2023-12-13 12:37:33","HTML","","","",,,,,183,26.14,61,3,7,"In this mixed-method study, we examined the design and potential impact of a mixed-reality integrated learning environment (MILE) in providing the simulated and immersive teaching …","https://www.sciencedirect.com/science/article/pii/S0747563216302655","https://scholar.google.com/scholar?q=related:TWk7OtRXMs0J:scholar.google.com/&scioq=intitle:mixed+intitle:reality&hl=en&as_sdt=0,5&as_ylo=2003&as_yhi=2023"
180,"JA De Guzman, K Thilakarathna…","Security and privacy approaches in mixed reality: A literature survey",2019,"ACM Computing Surveys …","dl.acm.org","https://dl.acm.org/doi/abs/10.1145/3359626","https://scholar.google.com/scholar?cites=5926412758756251007&as_sdt=2005&sciodt=0,5&hl=en",33,"2023-12-13 12:37:33","","10.1145/3359626","","",,,,,180,45.00,60,3,4,"… and approaches on mixed reality. To this end, this work makes the following contributions: … (2) We include a collection of other relevant work not necessarily directed to mixed reality but …","https://dl.acm.org/doi/pdf/10.1145/3359626","https://scholar.google.com/scholar?q=related:f1UCLgHZPlIJ:scholar.google.com/&scioq=intitle:mixed+intitle:reality&hl=en&as_sdt=0,5&as_ylo=2003&as_yhi=2023"
